,page,img_cnt,img_npy_lst,text,tables,entities,relationships,summary_rel,summary,highlights
22,111,0,[],"79
Using namespaces to group resources
has a corresponding API object that you can create, read, update, and delete by post-
ing a YAML manifest to the API server.
 You could have created the namespace like this:
$ kubectl create namespace custom-namespace
namespace ""custom-namespace"" created
NOTE
Although most objects’ names must conform to the naming conven-
tions specified in RFC 1035 (Domain names), which means they may contain
only letters, digits, dashes, and dots, namespaces (and a few others) aren’t
allowed to contain dots. 
3.7.4
Managing objects in other namespaces
To create resources in the namespace you’ve created, either add a namespace: custom-
namespace entry to the metadata section, or specify the namespace when creating the
resource with the kubectl create command:
$ kubectl create -f kubia-manual.yaml -n custom-namespace
pod ""kubia-manual"" created
You now have two pods with the same name (kubia-manual). One is in the default
namespace, and the other is in your custom-namespace.
 When listing, describing, modifying, or deleting objects in other namespaces, you
need to pass the --namespace (or -n) flag to kubectl. If you don’t specify the name-
space, kubectl performs the action in the default namespace configured in the cur-
rent kubectl context. The current context’s namespace and the current context itself
can be changed through kubectl config commands. To learn more about managing
kubectl contexts, refer to appendix A. 
TIP
To quickly switch to a different namespace, you can set up the following
alias: alias kcd='kubectl config set-context $(kubectl config current-
context) --namespace '. You can then switch between namespaces using kcd
some-namespace.
3.7.5
Understanding the isolation provided by namespaces
To wrap up this section about namespaces, let me explain what namespaces don’t pro-
vide—at least not out of the box. Although namespaces allow you to isolate objects
into distinct groups, which allows you to operate only on those belonging to the speci-
fied namespace, they don’t provide any kind of isolation of running objects. 
 For example, you may think that when different users deploy pods across different
namespaces, those pods are isolated from each other and can’t communicate, but that’s
not necessarily the case. Whether namespaces provide network isolation depends on
which networking solution is deployed with Kubernetes. When the solution doesn’t
provide inter-namespace network isolation, if a pod in namespace foo knows the IP
 
",[],"[{'entity': 'namespaces', 'description': 'A way to group resources in Kubernetes', 'category': 'software'}, {'entity': 'API object', 'description': 'An object that can be created, read, updated, and deleted by posting a YAML manifest to the API server', 'category': 'software'}, {'entity': 'kubectl', 'description': 'A command-line tool for managing Kubernetes resources', 'category': 'software'}, {'entity': 'create namespace', 'description': 'A command to create a new namespace in Kubernetes', 'category': 'command'}, {'entity': 'custom-namespace', 'description': 'A custom namespace created using the `kubectl create` command', 'category': 'software'}, {'entity': 'metadata section', 'description': 'A section in a YAML manifest that specifies the metadata for a resource', 'category': 'software'}, {'entity': 'kubia-manual.yaml', 'description': 'A YAML manifest file used to create a pod in a specific namespace', 'category': 'file'}, {'entity': 'pod', 'description': 'A container that can run one or more applications', 'category': 'software'}, {'entity': 'default namespace', 'description': 'The default namespace in which resources are created if no other namespace is specified', 'category': 'software'}, {'entity': '--namespace flag', 'description': 'A flag used with the `kubectl` command to specify a namespace for an action', 'category': 'flag'}, {'entity': 'kubectl config commands', 'description': 'Commands used to manage Kubernetes contexts and namespaces', 'category': 'software'}, {'entity': 'alias kcd', 'description': 'An alias created to quickly switch between namespaces using the `kubectl` command', 'category': 'command'}, {'entity': 'networking solution', 'description': 'A solution that provides network isolation between namespaces in Kubernetes', 'category': 'software'}, {'entity': 'inter-namespace network isolation', 'description': 'The ability of a networking solution to isolate pods across different namespaces', 'category': 'feature'}]","[{'source_entity': '""default namespace""', 'description': 'is used to create a new namespace', 'destination_entity': '""namespaces""'}, {'source_entity': '""kubectl config commands""', 'description': 'are used to configure kubectl for a specific namespace', 'destination_entity': '""default namespace""'}, {'source_entity': '""kubectl config commands""', 'description': ""can be used to create a new namespace using the '--namespace flag'"", 'destination_entity': '""--namespace flag""'}, {'source_entity': '""create namespace""', 'description': 'is a command used to create a new namespace', 'destination_entity': '""namespaces""'}, {'source_entity': '""pod""', 'description': ""can be created within a specific namespace using the '--namespace flag'"", 'destination_entity': '""--namespace flag""'}, {'source_entity': '""create namespace""', 'description': 'requires a metadata section to specify details about the new namespace', 'destination_entity': '""metadata section""'}, {'source_entity': '""namespaces""', 'description': 'can be used as an API object to manage namespaces within a cluster', 'destination_entity': '""API object""'}, {'source_entity': '""inter-namespace network isolation""', 'description': 'is achieved by configuring networking solutions for each namespace', 'destination_entity': '""networking solution""'}, {'source_entity': '""kubectl""', 'description': ""can be used to create a custom namespace using the 'create namespace' command"", 'destination_entity': '""custom-namespace""'}, {'source_entity': '""alias kcd""', 'description': ""is an alias for the 'kubectl config commands' which can be used to configure kubectl for a specific namespace"", 'destination_entity': '""kubectl config commands""'}]","['[\n  {\n    ""source"": ""default namespace"",\n    ""destination"": ""pod"",\n    ""relation_description"": ""is used to create a new namespace"",\n    ""summary_er"": ""The default namespace is created to host a new pod, allowing for resource isolation and management.""\n  }\n]', '[\n  {\n    ""source"": ""kubectl config commands"",\n    ""destination"": ""pod"",\n    ""relation_description"": ""are used to configure kubectl for a specific namespace"",\n    ""summary_er"": ""Configuring kubectl for a specific namespace allows users to manage pods within that namespace.""\n  }\n]', '[\n  {\n    ""source"": ""kubectl config commands"",\n    ""destination"": ""--namespace flag"",\n    ""relation_description"": ""can be used to create a new namespace"",\n    ""summary_er"": ""The \'kubectl config\' command can be used with \'--namespace\' flag to create a new namespace for pods.""\n  }\n]', '[\n  {\n    ""source"": ""create namespace"",\n    ""destination"": ""pod"",\n    ""relation_description"": ""is a command used to create a new namespace"",\n    ""summary_er"": ""The \'create namespace\' command creates a new namespace, which is a logical isolation of resources in Kubernetes.""\n  }\n]', '[\n  {\n    ""source"": ""Pod"",\n    ""destination"": ""Namespace"",\n    ""relation_description"": ""can be created within a specific namespace using the \'--namespace flag\'"",\n    ""summary_er"": ""A pod can be created within a specified namespace by utilizing the \'--namespace\' flag.""\n  }\n]', '[\n  {\n    ""source"": ""create namespace"",\n    ""destination"": ""pod"",\n    ""relation_description"": ""requires a metadata section to specify details about the new namespace"",\n    ""summary_er"": ""To create a namespace, a metadata section must be specified with details about the new namespace.""\n  },\n  {\n    ""source"": ""metadata section"",\n    ""destination"": ""pod"",\n    ""relation_description"": ""specifies details about the new namespace"",\n    ""summary_er"": ""A metadata section specifies details about the new namespace for the pod.""\n  }\n]', '[\n  {\n    ""source"": ""namespaces"",\n    ""destination"": ""pod"",\n    ""relation_description"": ""can be used as an API object to manage namespaces within a cluster"",\n    ""summary_er"": ""Namespaces can be managed using API objects, which enable cluster-wide management.""\n  }\n]', '[\n  {\n    ""source"": ""inter-namespace network isolation"",\n    ""destination"": ""pod"",\n    ""relation_description"": ""is achieved by configuring networking solutions for each namespace"",\n    ""summary_er"": ""Inter-namespace isolation is enforced by setting up separate networking configurations for each pod, ensuring secure communication within namespaces.""\n  },\n  {\n    ""source"": ""inter-namespace network isolation"",\n    ""destination"": ""networking solution"",\n    ""relation_description"": ""is achieved by configuring networking solutions for each namespace"",\n    ""summary_er"": ""Inter-namespace isolation relies on customized networking solutions to establish secure connections between pods across different namespaces.""\n  }\n]', '[\n  {\n    ""source"": ""kubectl"",\n    ""destination"": ""pod"",\n    ""relation_description"": ""can be used to create a custom namespace using the \'create namespace\' command"",\n    ""summary_er"": ""Kubectl can create custom namespaces for pods, utilizing the \'create namespace\' command.""\n  }\n]', '[\n  {\n    ""source"": ""alias kcd"",\n    ""destination"": ""kubectl config commands"",\n    ""relation_description"": ""is an alias for"",\n    ""summary_er"": ""Alias \'kcd\' is used to configure kubectl for a specific namespace, providing easy access to kubectl commands.""\n  },\n  {\n    ""source"": ""kubectl config commands"",\n    ""destination"": ""pod"",\n    ""relation_description"": ""used to configure"",\n    ""summary_er"": ""Kubectl config commands are used to configure and manage pods in a Kubernetes cluster.""\n  }\n]']","Namespaces allow grouping resources and can be created using kubectl create command or by posting YAML manifest to API server. Resources in other namespaces can be managed by adding namespace entry to metadata section or specifying namespace with kubectl create command. Namespaces provide isolation for objects, but do not guarantee network isolation between pods across different namespaces.","[{'highlight': 'You can create a namespace using the command $ kubectl create namespace custom-namespace'}, {'highlight': ""Namespaces don't provide any kind of isolation of running objects, and pods across different namespaces can communicate with each other if the networking solution doesn't provide inter-namespace network isolation""}, {'highlight': 'To create resources in a specific namespace, you need to add a namespace: custom-namespace entry to the metadata section or specify the namespace when creating the resource with the kubectl create command'}, {'highlight': ""You can quickly switch between namespaces using an alias like alias kcd='kubectl config set-context $(kubectl config current-context) --namespace ' and then use kcd some-namespace to switch""}, {'highlight': ""Namespaces allow you to isolate objects into distinct groups, but they don't provide any kind of isolation of running objects out of the box""}]"
23,112,0,[],"80
CHAPTER 3
Pods: running containers in Kubernetes
address of a pod in namespace bar, there is nothing preventing it from sending traffic,
such as HTTP requests, to the other pod. 
3.8
Stopping and removing pods
You’ve created a number of pods, which should all still be running. You have four
pods running in the default namespace and one pod in custom-namespace. You’re
going to stop all of them now, because you don’t need them anymore.
3.8.1
Deleting a pod by name
First, delete the kubia-gpu pod by name:
$ kubectl delete po kubia-gpu
pod ""kubia-gpu"" deleted
By deleting a pod, you’re instructing Kubernetes to terminate all the containers that are
part of that pod. Kubernetes sends a SIGTERM signal to the process and waits a certain
number of seconds (30 by default) for it to shut down gracefully. If it doesn’t shut down
in time, the process is then killed through SIGKILL. To make sure your processes are
always shut down gracefully, they need to handle the SIGTERM signal properly. 
TIP
You can also delete more than one pod by specifying multiple, space-sep-
arated names (for example, kubectl delete po pod1 pod2).
3.8.2
Deleting pods using label selectors
Instead of specifying each pod to delete by name, you’ll now use what you’ve learned
about label selectors to stop both the kubia-manual and the kubia-manual-v2 pod.
Both pods include the creation_method=manual label, so you can delete them by
using a label selector:
$ kubectl delete po -l creation_method=manual
pod ""kubia-manual"" deleted
pod ""kubia-manual-v2"" deleted 
In the earlier microservices example, where you had tens (or possibly hundreds) of
pods, you could, for instance, delete all canary pods at once by specifying the
rel=canary label selector (visualized in figure 3.10):
$ kubectl delete po -l rel=canary
3.8.3
Deleting pods by deleting the whole namespace
Okay, back to your real pods. What about the pod in the custom-namespace? You no
longer need either the pods in that namespace, or the namespace itself. You can
 
",[],"[{'entity': 'Pod', 'description': 'A container running in Kubernetes', 'category': 'container'}, {'entity': 'Kubernetes', 'description': 'An open-source container orchestration system', 'category': 'software'}, {'entity': 'kubectl', 'description': 'The command-line tool for interacting with Kubernetes', 'category': 'command'}, {'entity': 'SIGTERM', 'description': 'A signal sent to a process to terminate it gracefully', 'category': 'signal'}, {'entity': 'SIGKILL', 'description': 'A signal sent to a process to kill it immediately', 'category': 'signal'}, {'entity': 'label selector', 'description': 'A way to select pods based on labels attached to them', 'category': 'selector'}, {'entity': 'namespace', 'description': 'A logical grouping of resources in Kubernetes', 'category': 'resource'}, {'entity': 'pod name', 'description': 'The unique identifier for a pod', 'category': 'identifier'}, {'entity': 'creation_method=manual label', 'description': 'A label attached to pods created manually', 'category': 'label'}, {'entity': 'rel=canary label', 'description': 'A label attached to canary pods', 'category': 'label'}]","[{'source_entity': '""Kubernetes""', 'description': 'manages', 'destination_entity': '""pod name""'}, {'source_entity': '""kubectl""', 'description': 'interacts with', 'destination_entity': '""Kubernetes""'}, {'source_entity': '""label selector""', 'description': 'applies to', 'destination_entity': '""Pod""'}, {'source_entity': '""SIGTERM""', 'description': 'sends signal to', 'destination_entity': '""pod name""'}, {'source_entity': '""SIGKILL""', 'description': 'terminates', 'destination_entity': '""pod name""'}, {'source_entity': '""namespace""', 'description': 'contains', 'destination_entity': '""Pod""'}, {'source_entity': '""creation_method=manual label""', 'description': 'applies to', 'destination_entity': '""Pod""'}, {'source_entity': '""rel=canary label""', 'description': 'applies to', 'destination_entity': '""Pod""'}]","['[\n  {\n    ""source"": ""Kubernetes"",\n    ""destination"": ""pod"",\n    ""relation_description"": ""manages"",\n    ""summary_er"": ""Kubernetes manages a containerized application or service, in this case, a pod named \'pod name\'.""\n  }\n]', '[\n  {\n    ""source"": ""kubectl"",\n    ""destination"": ""pod"",\n    ""relation_description"": ""interacts with"",\n    ""summary_er"": ""kubectl, a command-line tool, interacts with Kubernetes to manage and deploy pods.""\n  }\n]', '[\n  {\n    ""source"": ""Label Selector"",\n    ""destination"": ""Pod"",\n    ""relation_description"": ""applies to"",\n    ""summary_er"": ""A label selector is used to select a Pod based on its labels, allowing for targeted resource management and deployment.""\n  }\n]', '[\n  {\n    ""source"": ""SIGTERM"",\n    ""destination"": ""pod name"",\n    ""relation_description"": ""sends signal to"",\n    ""summary_er"": ""The SIGTERM signal is sent to a pod, instructing it to terminate its execution.""\n  }\n]', '[\n  {\n    ""source"": ""SIGKILL"",\n    ""destination"": ""pod name"",\n    ""relation_description"": ""terminates"",\n    ""summary_er"": ""The SIGKILL signal terminates a running pod, effectively killing it.""\n  }\n]', '[\n  {\n    ""source"": ""namespace"",\n    ""destination"": ""pod"",\n    ""relation_description"": ""contains"",\n    ""summary_er"": ""A namespace in Kubernetes contains one or more pods, which are the basic execution units of a containerized application.""\n  }\n]', '[\n  {\n    ""source"": ""creation_method=manual label"",\n    ""destination"": ""Pod"",\n    ""relation_description"": ""applies to"",\n    ""summary_er"": ""Manual labels are applied to pods for identification and organization purposes.""\n  }\n]', '[\n  {\n    ""source"": ""Canary Label"",\n    ""destination"": ""Pod"",\n    ""relation_description"": ""applies to"",\n    ""summary_er"": ""A canary label is applied to a pod, indicating its purpose or characteristics.""\n  }\n]']","Pods in Kubernetes can communicate with each other within a namespace. To stop and remove pods, use kubectl delete command. Pods can be deleted by name, label selector, or even deleting the whole namespace. When deleting a pod, Kubernetes sends a SIGTERM signal to shut down containers, and if they don't respond, a SIGKILL signal is sent. It's essential for processes to handle the SIGTERM signal properly.","[{'highlight': 'You can delete a pod by specifying its name using the kubectl delete command: $ kubectl delete po <pod_name>'}, {'highlight': 'Kubernetes sends a SIGTERM signal to the process and waits 30 seconds for it to shut down gracefully, before killing it through SIGKILL'}, {'highlight': 'You can use label selectors to delete multiple pods at once using the kubectl delete command: $ kubectl delete po -l <label_selector>'}, {'highlight': 'Deleting a namespace will also delete all pods and resources within that namespace'}, {'highlight': 'To make sure processes are shut down gracefully, they need to handle the SIGTERM signal properly'}]"
