,page,img_cnt,img_npy_lst,text,tables,entities,relationships,summary_rel,summary,highlights
20,109,0,[],"77
Using namespaces to group resources
 But what about times when you want to split objects into separate, non-overlapping
groups? You may want to only operate inside one group at a time. For this and other
reasons, Kubernetes also groups objects into namespaces. These aren’t the Linux
namespaces we talked about in chapter 2, which are used to isolate processes from
each other. Kubernetes namespaces provide a scope for objects names. Instead of hav-
ing all your resources in one single namespace, you can split them into multiple name-
spaces, which also allows you to use the same resource names multiple times (across
different namespaces).
3.7.1
Understanding the need for namespaces
Using multiple namespaces allows you to split complex systems with numerous com-
ponents into smaller distinct groups. They can also be used for separating resources
in a multi-tenant environment, splitting up resources into production, development,
and QA environments, or in any other way you may need. Resource names only need
to be unique within a namespace. Two different namespaces can contain resources of
the same name. But, while most types of resources are namespaced, a few aren’t. One
of them is the Node resource, which is global and not tied to a single namespace.
You’ll learn about other cluster-level resources in later chapters.
 Let’s see how to use namespaces now.
3.7.2
Discovering other namespaces and their pods
First, let’s list all namespaces in your cluster:
$ kubectl get ns
NAME          LABELS    STATUS    AGE
default       <none>    Active    1h
kube-public   <none>    Active    1h
kube-system   <none>    Active    1h
Up to this point, you’ve operated only in the default namespace. When listing resources
with the kubectl get command, you’ve never specified the namespace explicitly, so
kubectl always defaulted to the default namespace, showing you only the objects in
that namespace. But as you can see from the list, the kube-public and the kube-system
namespaces also exist. Let’s look at the pods that belong to the kube-system name-
space, by telling kubectl to list pods in that namespace only:
$ kubectl get po --namespace kube-system
NAME                                 READY     STATUS    RESTARTS   AGE
fluentd-cloud-kubia-e8fe-node-txje   1/1       Running   0          1h
heapster-v11-fz1ge                   1/1       Running   0          1h
kube-dns-v9-p8a4t                    0/4       Pending   0          1h
kube-ui-v4-kdlai                     1/1       Running   0          1h
l7-lb-controller-v0.5.2-bue96        2/2       Running   92         1h
TIP
You can also use -n instead of --namespace.
 
",[],"[{'entity': 'namespaces', 'description': 'groups objects into namespaces for resource management', 'category': 'software'}, {'entity': 'Kubernetes', 'description': 'container orchestration system', 'category': 'software'}, {'entity': 'Linux namespaces', 'description': 'used to isolate processes from each other', 'category': 'software'}, {'entity': 'resources', 'description': 'managed by Kubernetes using namespaces', 'category': 'software'}, {'entity': 'names', 'description': 'only need to be unique within a namespace', 'category': 'software'}, {'entity': 'Node resource', 'description': 'global and not tied to a single namespace', 'category': 'software'}, {'entity': 'kubectl get command', 'description': 'used to list resources in a namespace', 'category': 'command'}, {'entity': 'namespace', 'description': 'a scope for objects names', 'category': 'hardware'}, {'entity': 'default namespace', 'description': 'the default namespace used by Kubernetes', 'category': 'software'}, {'entity': 'kube-public namespace', 'description': 'a namespace used by Kubernetes', 'category': 'software'}, {'entity': 'kube-system namespace', 'description': 'a namespace used by Kubernetes', 'category': 'software'}, {'entity': 'pods', 'description': 'managed by Kubernetes using namespaces', 'category': 'software'}, {'entity': 'fluentd-cloud-kubia-e8fe-node-txje pod', 'description': 'a pod in the kube-system namespace', 'category': 'software'}, {'entity': 'heapster-v11-fz1ge pod', 'description': 'a pod in the kube-system namespace', 'category': 'software'}, {'entity': 'kube-dns-v9-p8a4t pod', 'description': 'a pod in the kube-system namespace', 'category': 'software'}, {'entity': 'kube-ui-v4-kdlai pod', 'description': 'a pod in the kube-system namespace', 'category': 'software'}, {'entity': 'l7-lb-controller-v0.5.2-bue96 pod', 'description': 'a pod in the kube-system namespace', 'category': 'software'}]","[{'source_entity': '""l7-lb-controller-v0.5.2-bue96 pod""', 'description': 'runs within', 'destination_entity': '""default namespace""'}, {'source_entity': '""l7-lb-controller-v0.5.2-bue96 pod""', 'description': 'uses', 'destination_entity': '""Linux namespaces""'}, {'source_entity': '""heapster-v11-fz1ge pod""', 'description': 'monitors', 'destination_entity': '""pods""'}, {'source_entity': '""kubectl get command""', 'description': 'lists', 'destination_entity': '""namespaces""'}, {'source_entity': '""kube-system namespace""', 'description': 'belongs to', 'destination_entity': '""Kubernetes""'}, {'source_entity': '""kube-public namespace""', 'description': 'is a type of', 'destination_entity': '""namespace""'}, {'source_entity': '""kube-dns-v9-p8a4t pod""', 'description': 'resolves DNS for', 'destination_entity': '""pods""'}, {'source_entity': '""kube-ui-v4-kdlai pod""', 'description': 'provides UI for', 'destination_entity': '""Kubernetes""'}, {'source_entity': '""fluentd-cloud-kubia-e8fe-node-txje pod""', 'description': 'collects logs from', 'destination_entity': '""pods""'}, {'source_entity': '""resources""', 'description': 'are managed by', 'destination_entity': '""Kubernetes""'}, {'source_entity': '""names""', 'description': 'are used to identify', 'destination_entity': '""resources""'}, {'source_entity': '""Node resource""', 'description': 'is a type of', 'destination_entity': '""resources""'}]","['[\n  {\n    ""source"": ""l7-lb-controller-v0.5.2-bue96"",\n    ""destination"": ""pod"",\n    ""relation_description"": ""runs within"",\n    ""summary_er"": ""The l7-lb-controller-v0.5.2-bue96 pod runs within a containerized environment.""\n  },\n  {\n    ""source"": ""default namespace"",\n    ""destination"": ""pod"",\n    ""relation_description"": ""contains"",\n    ""summary_er"": ""The default namespace contains the pod, which is a deployable unit of an application.""\n  }\n]', '[\n  {\n    ""source"": ""l7-lb-controller-v0.5.2-bue96"",\n    ""destination"": ""pod"",\n    ""relation_description"": ""uses"",\n    ""summary_er"": ""The l7-lb-controller-v0.5.2-bue96 pod utilizes a Linux namespace for its operation.""\n  }\n]', '[\n  {\n    ""source"": ""heapster-v11-fz1ge"",\n    ""destination"": ""pod"",\n    ""relation_description"": ""monitors"",\n    ""summary_er"": ""Heapster monitors the heapster-v11-fz1ge pod\'s performance and resource utilization.""\n  },\n  {\n    ""source"": ""pods"",\n    ""destination"": ""heapster-v11-fz1ge"",\n    ""relation_description"": ""contains"",\n    ""summary_er"": ""The pods list contains information about the heapster-v11-fz1ge pod, including its status and metrics.""\n  }\n]', '[\n  {\n    ""source"": ""kubectl"",\n    ""destination"": ""pod"",\n    ""relation_description"": ""lists"",\n    ""summary_er"": ""Kubectl command retrieves a list of running pods in a Kubernetes cluster.""\n  },\n  {\n    ""source"": ""kubectl"",\n    ""destination"": ""namespaces"",\n    ""relation_description"": ""lists"",\n    ""summary_er"": ""Kubectl command lists all namespaces in a Kubernetes cluster, providing information on each namespace\'s ID and name.""\n  }\n]', '[\n  {\n    ""source"": ""kube-system namespace"",\n    ""destination"": ""pod"",\n    ""relation_description"": ""belongs to"",\n    ""summary_er"": ""The kube-system namespace contains pods that belong to it, providing a logical grouping for Kubernetes resources.""\n  },\n  {\n    ""source"": ""Kubernetes"",\n    ""destination"": ""pod"",\n    ""relation_description"": ""contains"",\n    ""summary_er"": ""Kubernetes manages and orchestrates the lifecycle of pods, ensuring efficient resource utilization and scalability.""\n  }\n]', '[\n  {\n    ""source"": ""kube-public namespace"",\n    ""destination"": ""pod"",\n    ""relation_description"": ""is a type of"",\n    ""summary_er"": ""The kube-public namespace is a type of pod that provides public data to all pods in a Kubernetes cluster.""\n  }\n]', '[\n  {\n    ""source"": ""kube-dns-v9-p8a4t pod"",\n    ""destination"": ""pods"",\n    ""relation_description"": ""resolves DNS for"",\n    ""summary_er"": ""The Kube-DNS pod resolves DNS queries for all pods in the cluster, ensuring they can communicate with each other.""\n  }\n]', '[\n  {\n    ""source"": ""kube-ui-v4-kdlai pod"",\n    ""destination"": ""Kubernetes"",\n    ""relation_description"": ""provides UI for"",\n    ""summary_er"": ""The kube-ui-v4-kdlai pod provides a user interface for Kubernetes, enabling users to interact with the system.""\n  }\n]', '[\n  {\n    ""source"": ""fluentd-cloud-kubia-e8fe-node-txje pod"",\n    ""destination"": ""pods"",\n    ""relation_description"": ""collects logs from"",\n    ""summary_er"": ""The fluentd-cloud-kubia-e8fe-node-txje pod collects logs from the pods.""\n  }\n]', '[\n  {\n    ""source"": ""resources"",\n    ""destination"": ""pod"",\n    ""relation_description"": ""are managed by"",\n    ""summary_er"": ""Resources in Kubernetes are managed by pods, which are the basic execution units of a containerized application.""\n  },\n  {\n    ""source"": ""Kubernetes"",\n    ""destination"": ""pod"",\n    ""relation_description"": ""basic execution unit"",\n    ""summary_er"": ""In Kubernetes, a pod is the basic execution unit that contains one or more containers and provides shared resources such as IP address and port space.""\n  }\n]', '[{""source"": ""names"", ""destination"": ""pod"", ""relation_description"": ""are used to identify"", ""summary_er"": ""Pod names serve as identifiers, allowing for easy reference and management.""}, {""source"": ""resources"", ""destination"": ""pod"", ""relation_description"": ""are used to identify"", ""summary_er"": ""Resources are utilized by pods to function properly, including CPU, memory, and storage allocations.""}]', '[\n  {\n    ""source"": ""Node resource"",\n    ""destination"": ""pod resources"",\n    ""relation_description"": ""is a type of"",\n    ""summary_er"": ""A node\'s resources are allocated to a pod, which can utilize them for execution.""\n  }\n]']","Kubernetes groups objects into namespaces, which provide a scope for object names and allow for separate, non-overlapping groups. Namespaces enable operating within one group at a time and using the same resource names multiple times across different namespaces. They can be used to split complex systems, separate resources in multi-tenant environments, or divide resources into production, development, and QA environments.","[{'highlight': 'Kubernetes groups objects into namespaces to provide a scope for object names and allow the same resource name to be used multiple times across different namespaces.'}, {'highlight': 'Namespaces in Kubernetes are not like Linux namespaces, which isolate processes from each other, but rather provide a way to split complex systems into smaller distinct groups or separate resources in a multi-tenant environment.'}, {'highlight': 'The Node resource is global and not tied to a single namespace, unlike most types of resources that are namespaced.'}, {'highlight': 'You can list all namespaces in your cluster using the command kubectl get ns and specify a namespace explicitly with the --namespace flag or -n shorthand.'}, {'highlight': 'Resource names only need to be unique within a namespace, allowing you to use the same name multiple times across different namespaces.'}]"
21,110,0,[],"78
CHAPTER 3
Pods: running containers in Kubernetes
You’ll learn about these pods later in the book (don’t worry if the pods shown here
don’t match the ones on your system exactly). It’s clear from the name of the name-
space that these are resources related to the Kubernetes system itself. By having
them in this separate namespace, it keeps everything nicely organized. If they were
all in the default namespace, mixed in with the resources you create yourself, you’d
have a hard time seeing what belongs where, and you might inadvertently delete sys-
tem resources. 
 Namespaces enable you to separate resources that don’t belong together into non-
overlapping groups. If several users or groups of users are using the same Kubernetes
cluster, and they each manage their own distinct set of resources, they should each use
their own namespace. This way, they don’t need to take any special care not to inad-
vertently modify or delete the other users’ resources and don’t need to concern them-
selves with name conflicts, because namespaces provide a scope for resource names,
as has already been mentioned.
  Besides isolating resources, namespaces are also used for allowing only certain users
access to particular resources and even for limiting the amount of computational
resources available to individual users. You’ll learn about this in chapters 12 through 14.
3.7.3
Creating a namespace
A namespace is a Kubernetes resource like any other, so you can create it by posting a
YAML file to the Kubernetes API server. Let’s see how to do this now. 
CREATING A NAMESPACE FROM A YAML FILE
First, create a custom-namespace.yaml file with the following listing’s contents (you’ll
find the file in the book’s code archive).
apiVersion: v1
kind: Namespace         
metadata:
  name: custom-namespace  
Now, use kubectl to post the file to the Kubernetes API server:
$ kubectl create -f custom-namespace.yaml
namespace ""custom-namespace"" created
CREATING A NAMESPACE WITH KUBECTL CREATE NAMESPACE
Although writing a file like the previous one isn’t a big deal, it’s still a hassle. Luckily,
you can also create namespaces with the dedicated kubectl create namespace com-
mand, which is quicker than writing a YAML file. By having you create a YAML mani-
fest for the namespace, I wanted to reinforce the idea that everything in Kubernetes
Listing 3.6
A YAML definition of a namespace: custom-namespace.yaml
This says you’re 
defining a namespace.
This is the name 
of the namespace.
 
",[],"[{'entity': 'Pods', 'description': 'running containers in Kubernetes', 'category': 'application'}, {'entity': 'namespaces', 'description': 'separate resources that don’t belong together into non-overlapping groups', 'category': 'database'}, {'entity': 'kubectl', 'description': 'command to post a YAML file to the Kubernetes API server', 'category': 'software'}, {'entity': 'YAML', 'description': 'file format for defining resources in Kubernetes', 'category': 'software'}, {'entity': 'apiVersion', 'description': 'field in YAML file to specify the API version', 'category': 'database'}, {'entity': 'kind', 'description': 'field in YAML file to specify the type of resource', 'category': 'database'}, {'entity': 'metadata', 'description': 'field in YAML file to specify metadata about the resource', 'category': 'database'}, {'entity': 'name', 'description': 'field in YAML file to specify the name of the namespace', 'category': 'database'}, {'entity': 'custom-namespace', 'description': 'example namespace created using YAML file', 'category': 'application'}, {'entity': 'kubectl create', 'description': 'command to create a namespace from a YAML file', 'category': 'software'}, {'entity': 'create namespace', 'description': 'dedicated command to create a namespace', 'category': 'software'}]","[{'source_entity': 'kubectl', 'description': 'creates a new namespace', 'destination_entity': 'namespaces'}, {'source_entity': 'kubectl create', 'description': 'executes a command to create a resource', 'destination_entity': 'Pods'}, {'source_entity': 'create namespace', 'description': 'specifies the action of creating a new namespace', 'destination_entity': 'namespaces'}, {'source_entity': 'kubectl', 'description': 'executes a command to create a resource', 'destination_entity': 'custom-namespace'}, {'source_entity': 'metadata', 'description': 'provides additional information about the namespace', 'destination_entity': 'namespaces'}, {'source_entity': 'YAML', 'description': 'defines the configuration for creating a new namespace', 'destination_entity': 'custom-namespace'}]","['[\n  {\n    ""source"": ""kubectl"",\n    ""destination"": ""pod"",\n    ""relation_description"": ""creates a new"",\n    ""summary_er"": ""Using kubectl, a command-line tool, creates a new pod in a Kubernetes cluster.""\n  },\n  {\n    ""source"": ""kubectl"",\n    ""destination"": ""namespace"",\n    ""relation_description"": ""creates a new"",\n    ""summary_er"": ""Using kubectl, a command-line tool, creates a new namespace in a Kubernetes cluster.""\n  }\n]', '[\n  {\n    ""source"": ""kubectl"",\n    ""destination"": ""pod"",\n    ""relation_description"": ""executes a command to create a resource"",\n    ""summary_er"": ""Kubectl creates a pod by executing a command that creates a new resource, resulting in the creation of a running pod.""\n  }\n]', '[\n  {\n    ""source"": ""create namespace"",\n    ""destination"": ""namespaces"",\n    ""relation_description"": ""specifies the action of creating a new namespace"",\n    ""summary_er"": ""Creating a new namespace involves specifying the name, labels, and annotations for the namespace, which is then created by the Kubernetes API server.""\n  }\n]', '[\n  {\n    ""source"": ""kubectl"",\n    ""destination"": ""pod"",\n    ""relation_description"": ""executes a command to create a resource"",\n    ""summary_er"": ""Kubectl executes a command to create a pod in a specified namespace, utilizing Kubernetes API.""\n  }\n]', '[\n  {\n    ""source"": ""metadata"",\n    ""destination"": ""namespace"",\n    ""relation_description"": ""provides additional information about the namespace"",\n    ""summary_er"": ""Metadata provides context to the namespace, describing its properties and characteristics.""\n  },\n  {\n    ""source"": ""metadata"",\n    ""destination"": ""pod"",\n    ""relation_description"": ""provides additional information about the pod"",\n    ""summary_er"": ""Metadata provides supplementary details about the pod, including its configuration and behavior.""\n  }\n]', '[\n  {\n    ""source"": ""YAML"",\n    ""destination"": ""pod"",\n    ""relation_description"": ""defines the configuration for creating a new namespace"",\n    ""summary_er"": ""YAML defines the configuration for creating a pod, which in turn creates a custom namespace.""\n  },\n  {\n    ""source"": ""namespace"",\n    ""destination"": ""pod"",\n    ""relation_description"": ""custom-namespace"",\n    ""summary_er"": ""A custom namespace is created to isolate the pod\'s resources and configuration.""\n  }\n]']","Namespaces in Kubernetes enable separation of resources into non-overlapping groups, isolating them from other users' resources. They can be created by posting a YAML file to the Kubernetes API server using kubectl create -f or kubectl create namespace command.","[{'highlight': 'Namespaces enable you to separate resources that don’t belong together into non-overlapping groups.'}, {'highlight': 'You can create a namespace by posting a YAML file to the Kubernetes API server using kubectl.'}, {'highlight': 'A namespace is a Kubernetes resource like any other, so it can be created with the dedicated kubectl create namespace command.'}, {'highlight': 'Namespaces are used for isolating resources, allowing only certain users access to particular resources, and limiting computational resources available to individual users.'}, {'highlight': 'You can also create namespaces using the kubectl create -f custom-namespace.yaml command.'}]"
