,page,img_cnt,img_npy_lst,text,tables,entities,relationships,summary_rel,summary,highlights
430,519,0,[],"487
Understanding the pod’s lifecycle
you’ll only see a FailedPostStartHook warning among the pod’s events (you can see
them using kubectl describe pod). A while later, you’ll see more information on why
the hook failed, as shown in the following listing.
FailedSync   Error syncing pod, skipping: failed to ""StartContainer"" for 
             ""kubia"" with PostStart handler: command 'sh -c echo 'hook 
             will fail with exit code 15'; sleep 5 ; exit 15' exited 
             with 15: : ""PostStart Hook Failed"" 
The number 15 in the last line is the exit code of the command. When using an HTTP
GET hook handler, the reason may look like the following listing (you can try this by
deploying the post-start-hook-httpget.yaml file from the book’s code archive).
FailedSync   Error syncing pod, skipping: failed to ""StartContainer"" for 
             ""kubia"" with PostStart handler: Get 
             http://10.32.0.2:9090/postStart: dial tcp 10.32.0.2:9090: 
             getsockopt: connection refused: ""PostStart Hook Failed"" 
NOTE
The post-start hook is intentionally misconfigured to use port 9090
instead of the correct port 8080, to show what happens when the hook fails.
The standard and error outputs of command-based post-start hooks aren’t logged any-
where, so you may want to have the process the hook invokes log to a file in the con-
tainer’s filesystem, which will allow you to examine the contents of the file with
something like this:
$ kubectl exec my-pod cat logfile.txt 
If the container gets restarted for whatever reason (including because the hook failed),
the file may be gone before you can examine it. You can work around that by mount-
ing an emptyDir volume into the container and having the hook write to it.
USING A PRE-STOP CONTAINER LIFECYCLE HOOK
A pre-stop hook is executed immediately before a container is terminated. When a
container needs to be terminated, the Kubelet will run the pre-stop hook, if config-
ured, and only then send a SIGTERM to the process (and later kill the process if it
doesn’t terminate gracefully). 
 A pre-stop hook can be used to initiate a graceful shutdown of the container, if it
doesn’t shut down gracefully upon receipt of a SIGTERM signal. They can also be used
to perform arbitrary operations before shutdown without having to implement those
operations in the application itself (this is useful when you’re running a third-party
app, whose source code you don’t have access to and/or can’t modify). 
 Configuring a pre-stop hook in a pod manifest isn’t very different from adding a
post-start hook. The previous example showed a post-start hook that executes a com-
Listing 17.4
Pod’s events showing the exit code of the failed command-based hook
Listing 17.5
Pod’s events showing the reason why an HTTP GET hook failed
 
",[],"[{'entity': 'PostStart Hook', 'description': 'A hook executed immediately after a container starts.', 'category': 'container lifecycle'}, {'entity': 'FailedSync', 'description': 'An error syncing pod, skipping: failed to start container.', 'category': 'pod events'}, {'entity': 'PostStart handler', 'description': 'A command executed immediately after a container starts.', 'category': 'container lifecycle'}, {'entity': 'Get http://10.32.0.2:9090/postStart', 'description': 'An HTTP GET hook handler.', 'category': 'container lifecycle'}, {'entity': 'dial tcp 10.32.0.2:9090', 'description': 'A network error connecting to port 9090.', 'category': 'network'}, {'entity': 'connection refused', 'description': 'An error message indicating a connection was refused.', 'category': 'error'}, {'entity': 'kubectl describe pod', 'description': 'A command to display the events of a pod.', 'category': 'command'}, {'entity': 'SIGTERM', 'description': 'A signal sent to a process to terminate it gracefully.', 'category': 'process'}, {'entity': 'pre-stop hook', 'description': 'A hook executed immediately before a container is terminated.', 'category': 'container lifecycle'}, {'entity': 'emptyDir volume', 'description': 'A type of volume that can be used to persist data across container restarts.', 'category': 'volume'}, {'entity': 'kubectl exec my-pod cat logfile.txt', 'description': 'A command to execute a process in a pod and display its output.', 'category': 'command'}]","[{'source_entity': '""FailedSync""', 'description': 'failed to synchronize', 'destination_entity': '""dial tcp 10.32.0.2:9090""'}, {'source_entity': '""Get http://10.32.0.2:9090/postStart""', 'description': 'attempted to get post start data', 'destination_entity': '""connection refused""'}, {'source_entity': '""PostStart handler""', 'description': 'handled post start event', 'destination_entity': '""emptyDir volume""'}, {'source_entity': '""kubectl exec my-pod cat logfile.txt""', 'description': 'executed command to read log file', 'destination_entity': '""logfile.txt""'}, {'source_entity': '""PostStart Hook""', 'description': 'triggered post start hook', 'destination_entity': '""SIGTERM""'}, {'source_entity': '""kubectl describe pod""', 'description': 'described pod details', 'destination_entity': '""my-pod""'}]","['[\n    {\n        ""source"": ""Pod"",\n        ""destination"": ""Kubernetes Cluster"",\n        ""relation_description"": ""FailedSync"",\n        ""summary_er"": ""The pod failed to synchronize with the Kubernetes cluster due to a TCP connection issue.""\n    },\n    {\n        ""source"": ""TCP Connection"",\n        ""destination"": ""Pod"",\n        ""relation_description"": ""dial tcp 10.32.0.2:9090"",\n        ""summary_er"": ""The pod attempted to establish a TCP connection with the Kubernetes cluster on port 9090 but failed.""\n    }\n]', '[\n  {\n    ""source"": ""http://10.32.0.2:9090/postStart"",\n    ""destination"": ""pod"",\n    ""relation_description"": ""attempted to get post start data"",\n    ""summary_er"": ""The system attempted to retrieve post-start data from a pod, but encountered an error due to connection refusal.""\n  },\n  {\n    ""source"": ""http://10.32.0.2:9090/postStart"",\n    ""destination"": ""connection"",\n    ""relation_description"": ""refused"",\n    ""summary_er"": ""The system\'s attempt to establish a connection was refused, resulting in an error.""\n  },\n  {\n    ""source"": ""pod"",\n    ""destination"": ""http://10.32.0.2:9090/postStart"",\n    ""relation_description"": ""connection"",\n    ""summary_er"": ""A pod attempted to establish a connection with the system\'s post-start data endpoint.""\n  },\n  {\n    ""source"": ""error"",\n    ""destination"": ""http://10.32.0.2:9090/postStart"",\n    ""relation_description"": ""encountered"",\n    ""summary_er"": ""An error was encountered while attempting to retrieve post-start data from the system\'s endpoint.""\n  },\n  {\n    ""source"": ""connection"",\n    ""destination"": ""pod"",\n    ""relation_description"": ""refused"",\n    ""summary_er"": ""The connection attempt by a pod was refused, resulting in an error.""\n  }\n]', '[\n  {\n    ""source"": ""PostStart handler"",\n    ""destination"": ""pod"",\n    ""relation_description"": ""handled post start event"",\n    ""summary_er"": ""The PostStart handler in Kubernetes handles events that occur after a pod has started, ensuring proper initialization and setup.""\n  },\n  {\n    ""source"": ""emptyDir volume"",\n    ""destination"": ""pod"",\n    ""relation_description"": ""provides temporary storage"",\n    ""summary_er"": ""An emptyDir volume in Kubernetes provides temporary storage for a pod, allowing data to be stored during its execution without persisting after termination.""\n  }\n]', '[\n  {\n    ""source"": ""kubectl"",\n    ""destination"": ""my-pod"",\n    ""relation_description"": ""executed command to read log file"",\n    ""summary_er"": ""Kubernetes client executed a command on a pod to read a log file.""\n  },\n  {\n    ""source"": ""my-pod"",\n    ""destination"": ""logfile.txt"",\n    ""relation_description"": ""read from"",\n    ""summary_er"": ""A pod read a log file as part of its execution.""\n  }\n]', '[\n  {\n    ""source"": ""PostStart Hook"",\n    ""destination"": ""pod"",\n    ""relation_description"": ""triggered post start hook"",\n    ""summary_er"": ""The PostStart Hook is triggered after a pod has started, allowing for custom initialization scripts to run.""\n  },\n  {\n    ""source"": ""SIGTERM"",\n    ""destination"": ""process"",\n    ""relation_description"": ""signal sent to terminate process"",\n    ""summary_er"": ""SIGTERM is a signal sent to a process to request its termination, typically used in container orchestration systems like Kubernetes.""\n  }\n]', '[\n  {\n    ""source"": ""kubectl"",\n    ""destination"": ""pod"",\n    ""relation_description"": ""described pod details"",\n    ""summary_er"": ""Get detailed information about a specific Kubernetes pod using \'kubectl describe pod\' command.""\n  },\n  {\n    ""source"": ""pod"",\n    ""destination"": ""my-pod"",\n    ""relation_description"": ""destination"",\n    ""summary_er"": ""The target pod for the \'kubectl describe pod\' command is named \'my-pod\'.""\n  }\n]']","A pod's lifecycle includes post-start and pre-stop hooks, which can be used to execute commands or initiate a graceful shutdown. Post-start hooks are executed immediately after a container is started, while pre-stop hooks are executed before a container is terminated. If a hook fails, it will display an error message in the pod's events. To troubleshoot failed hooks, one can use kubectl describe pod and exec into the container to examine log files or mount an emptyDir volume for logging purposes.","[{'highlight': ""When a post-start hook fails, you'll see a FailedPostStartHook warning among the pod's events, followed by more information on why the hook failed.""}, {'highlight': ""The standard and error outputs of command-based post-start hooks aren't logged anywhere, so it's recommended to have the process invoked by the hook log to a file in the container's filesystem.""}, {'highlight': 'A pre-stop hook is executed immediately before a container is terminated and can be used to initiate a graceful shutdown of the container or perform arbitrary operations before shutdown.'}, {'highlight': 'Configuring a pre-stop hook in a pod manifest is similar to adding a post-start hook, but with a different lifecycle event.'}, {'highlight': ""When using an HTTP GET hook handler, the reason for failure may look like 'Get http://<ip>:9090/postStart: dial tcp <ip>:9090: getsockopt: connection refused', indicating a connection refusal error.""}]"
431,520,0,[],"488
CHAPTER 17
Best practices for developing apps
mand, so we’ll look at a pre-stop hook that performs an HTTP GET request now. The
following listing shows how to define a pre-stop HTTP GET hook in a pod.
    lifecycle:
      preStop:            
        httpGet:          
          port: 8080          
          path: shutdown      
The pre-stop hook defined in this listing performs an HTTP GET request to http:/
/
POD_IP:8080/shutdown as soon as the Kubelet starts terminating the container.
Apart from the port and path shown in the listing, you can also set the fields scheme
(HTTP or HTTPS) and host, as well as httpHeaders that should be sent in the
request. The host field defaults to the pod IP. Be sure not to set it to localhost,
because localhost would refer to the node, not the pod.
 In contrast to the post-start hook, the container will be terminated regardless of
the result of the hook—an error HTTP response code or a non-zero exit code when
using a command-based hook will not prevent the container from being terminated.
If the pre-stop hook fails, you’ll see a FailedPreStopHook warning event among the
pod’s events, but because the pod is deleted soon afterward (after all, the pod’s dele-
tion is what triggered the pre-stop hook in the first place), you may not even notice
that the pre-stop hook failed to run properly. 
TIP
If the successful completion of the pre-stop hook is critical to the proper
operation of your system, verify whether it’s being executed at all. I’ve wit-
nessed situations where the pre-stop hook didn’t run and the developer
wasn’t even aware of that.
USING A PRE-STOP HOOK BECAUSE YOUR APP DOESN’T RECEIVE THE SIGTERM SIGNAL
Many developers make the mistake of defining a pre-stop hook solely to send a SIGTERM
signal to their apps in the pre-stop hook. They do this because they don’t see their appli-
cation receive the SIGTERM signal sent by the Kubelet. The reason why the signal isn’t
received by the application isn’t because Kubernetes isn’t sending it, but because the sig-
nal isn’t being passed to the app process inside the container itself. If your container
image is configured to run a shell, which in turn runs the app process, the signal may be
eaten up by the shell itself, instead of being passed down to the child process.
 In such cases, instead of adding a pre-stop hook to send the signal directly to your
app, the proper fix is to make sure the shell passes the signal to the app. This can be
achieved by handling the signal in the shell script running as the main container pro-
cess and then passing it on to the app. Or you could not configure the container image
to run a shell at all and instead run the application binary directly. You do this by using
the exec form of ENTRYPOINT or CMD in the Dockerfile: ENTRYPOINT [""/mybinary""]
instead of ENTRYPOINT /mybinary.
Listing 17.6
A pre-stop hook YAML snippet: pre-stop-hook-httpget.yaml
This is a pre-stop hook that 
performs an HTTP GET request.
The request is sent to 
http://POD_IP:8080/shutdown.
 
",[],"[{'entity': 'pre-stop hook', 'description': 'A hook that performs an HTTP GET request before a pod is terminated.', 'category': 'application'}, {'entity': 'httpGet', 'description': ""A field used to define a pre-stop hook in a pod's YAML file."", 'category': 'command'}, {'entity': 'port', 'description': 'A field used to specify the port number for an HTTP GET request.', 'category': 'process'}, {'entity': 'path', 'description': 'A field used to specify the path for an HTTP GET request.', 'category': 'process'}, {'entity': 'scheme', 'description': 'A field used to specify the scheme (HTTP or HTTPS) for an HTTP GET request.', 'category': 'process'}, {'entity': 'host', 'description': 'A field used to specify the host for an HTTP GET request.', 'category': 'process'}, {'entity': 'httpHeaders', 'description': 'A field used to specify headers that should be sent in an HTTP GET request.', 'category': 'process'}, {'entity': 'Kubelet', 'description': 'The component responsible for terminating a pod and running pre-stop hooks.', 'category': 'application'}, {'entity': 'pod IP', 'description': 'The IP address of the pod being terminated.', 'category': 'network'}, {'entity': 'SIGTERM signal', 'description': 'A signal sent by the Kubelet to a container to terminate it.', 'category': 'signal'}, {'entity': 'container image', 'description': 'The image used to run a container, which can be configured to run a shell or an application binary directly.', 'category': 'image'}, {'entity': 'shell script', 'description': 'A script that runs as the main container process and can handle signals and pass them on to child processes.', 'category': 'script'}, {'entity': 'ENTRYPOINT', 'description': 'A command used in a Dockerfile to specify the default command to run when a container is started.', 'category': 'command'}, {'entity': 'CMD', 'description': 'A command used in a Dockerfile to specify an alternative command to run when a container is started.', 'category': 'command'}]","[{'source_entity': '""Kubelet""', 'description': 'executes', 'destination_entity': '""container image""'}, {'source_entity': '""httpGet""', 'description': 'requests', 'destination_entity': '""pod IP""'}, {'source_entity': '""CMD""', 'description': 'specifies', 'destination_entity': '""container image""'}, {'source_entity': '""ENTRYPOINT""', 'description': 'runs', 'destination_entity': '""container image""'}, {'source_entity': '""pre-stop hook""', 'description': 'executes', 'destination_entity': '""shell script""'}, {'source_entity': '""SIGTERM signal""', 'description': 'triggers', 'destination_entity': '""pre-stop hook""'}, {'source_entity': '""httpHeaders""', 'description': 'specifies', 'destination_entity': '""container image""'}, {'source_entity': '""scheme""', 'description': 'defines', 'destination_entity': '""port""'}, {'source_entity': '""path""', 'description': 'specifies', 'destination_entity': '""container image""'}]","['[\n  {\n    ""source"": ""Kubelet"",\n    ""destination"": ""pod"",\n    ""relation_description"": ""executes"",\n    ""summary_er"": ""The Kubelet executes a pod by running its container image.""\n  }\n]', '[\n  {\n    ""source"": ""httpGet"",\n    ""destination"": ""requests"",\n    ""relation_description"": ""requests"",\n    ""summary_er"": ""The httpGet relation retrieves HTTP requests from a source, which are then processed by the pod.""\n  },\n  {\n    ""source"": ""requests"",\n    ""destination"": ""pod IP"",\n    ""relation_description"": ""requests"",\n    ""summary_er"": ""The pod receives HTTP requests and processes them using its IP address.""\n  }\n]', '[\n  {\n    ""source"": ""CMD"",\n    ""destination"": ""pod"",\n    ""relation_description"": ""specifies"",\n    ""summary_er"": ""The CMD command in a Dockerfile specifies the default command to run inside a container when it\'s launched.""\n  },\n  {\n    ""source"": ""container image"",\n    ""destination"": ""pod"",\n    ""relation_description"": ""runs"",\n    ""summary_er"": ""A container image runs as a pod in Kubernetes, providing a lightweight and portable execution environment for applications.""\n  }\n]', '[\n  {\n    ""source"": ""ENTRYPOINT"",\n    ""destination"": ""pod"",\n    ""relation_description"": ""runs"",\n    ""summary_er"": ""The ENTRYPOINT instruction in a Dockerfile specifies the command to run when the container starts, which is executed within the context of a pod.""\n  },\n  {\n    ""source"": ""container image"",\n    ""destination"": ""pod"",\n    ""relation_description"": ""runs"",\n    ""summary_er"": ""A container image is used to create a new pod in Kubernetes, which runs the application and its dependencies.""\n  }\n]', '[\n  {\n    ""source"": ""pre-stop hook"",\n    ""destination"": ""pod"",\n    ""relation_description"": ""executes"",\n    ""summary_er"": ""A pre-stop hook executes a shell script in a pod, typically to perform cleanup or preparation tasks before the pod is terminated.""\n  }\n]', '[\n  {\n    ""source"": ""SIGTERM signal"",\n    ""destination"": ""pod"",\n    ""relation_description"": ""triggers"",\n    ""summary_er"": ""The SIGTERM signal triggers a pre-stop hook in a pod, initiating shutdown procedures.""\n  }\n]', '[\n  {\n    ""source"": ""httpHeaders"",\n    ""destination"": ""pod"",\n    ""relation_description"": ""specifies"",\n    ""summary_er"": ""The httpHeaders relation specifies that a pod\'s container image is associated with its HTTP headers.""\n  },\n  {\n    ""source"": ""container image"",\n    ""destination"": ""pod"",\n    ""relation_description"": ""associated with"",\n    ""summary_er"": ""A container image is associated with a pod, which is a logical host for the container.""\n  }\n]', '[\n  {\n    ""source"": ""scheme"",\n    ""destination"": ""pod"",\n    ""relation_description"": ""defines"",\n    ""summary_er"": ""The scheme defines a port for communication with a pod.""\n  },\n  {\n    ""source"": ""port"",\n    ""destination"": ""pod"",\n    ""relation_description"": ""for"",\n    ""summary_er"": ""A port is used for communication with a pod.""\n  }\n]', '[\n  {\n    ""source"": ""path"",\n    ""destination"": ""pod"",\n    ""relation_description"": ""specifies"",\n    ""summary_er"": ""The path attribute in Kubernetes specifies the container image for a pod.""\n  },\n  {\n    ""source"": ""container image"",\n    ""destination"": ""Docker"",\n    ""relation_description"": ""related to"",\n    ""summary_er"": ""A container image is related to Docker, which is used to build and run containers.""\n  }\n]']","Kubernetes pre-stop hooks can be used to perform actions before a pod is terminated, such as sending an HTTP GET request. However, if the hook fails or returns an error, it will not prevent the container from being terminated. It's also important to note that using a pre-stop hook solely to send a SIGTERM signal to an app is not necessary, and instead the shell should be configured to pass the signal to the app process. A pre-stop hook YAML snippet example is provided for performing an HTTP GET request in a pod.","[{'highlight': ""A pre-stop hook can be defined in a pod's lifecycle section with an httpGet field to perform an HTTP GET request before termination.""}, {'highlight': 'The host field in a pre-stop hook defaults to the pod IP, and setting it to localhost will refer to the node instead of the pod.'}, {'highlight': ""If the pre-stop hook fails, a FailedPreStopHook warning event is logged among the pod's events, but may not be noticed due to the pod being deleted soon afterward.""}, {'highlight': 'Defining a pre-stop hook solely to send a SIGTERM signal to an app is incorrect and can be fixed by handling the signal in the shell script running as the main container process or by running the application binary directly without a shell.'}, {'highlight': ""A pre-stop hook's successful completion is not guaranteed, and its execution should be verified if critical for system operation, especially when using a command-based hook.""}]"
