,page,img_cnt,img_npy_lst,text,tables,entities,relationships,summary_rel,summary,highlights
440,529,0,[],"497
Making your apps easy to run and manage in Kubernetes
This way, you don’t need to modify the code of your app at all. If your app already
ensures all in-flight requests are processed completely, this pre-stop delay may be all
you need.
17.4
Making your apps easy to run and manage in Kubernetes
I hope you now have a better sense of how to make your apps handle clients nicely.
Now we’ll look at other aspects of how an app should be built to make it easier to man-
age in Kubernetes.
17.4.1 Making manageable container images
When you package your app into an image, you can choose to include the app’s
binary executable and any additional libraries it needs, or you can package up a whole
OS filesystem along with the app. Way too many people do this, even though it’s usu-
ally unnecessary.
 Do you need every single file from an OS distribution in your image? Probably not.
Most of the files will never be used and will make your image larger than it needs to
be. Sure, the layering of images makes sure each individual layer is downloaded only
once, but even having to wait longer than necessary the first time a pod is scheduled
to a node is undesirable.
 Deploying new pods and scaling them should be fast. This demands having small
images without unnecessary cruft. If you’re building apps using the Go language, your
images don’t need to include anything else apart from the app’s single binary execut-
able file. This makes Go-based container images extremely small and perfect for
Kubernetes.
TIP
Use the FROM scratch directive in the Dockerfile for these images.
But in practice, you’ll soon see these minimal images are extremely difficult to debug.
The first time you need to run a tool such as ping, dig, curl, or something similar
inside the container, you’ll realize how important it is for container images to also
include at least a limited set of these tools. I can’t tell you what to include and what
not to include in your images, because it depends on how you do things, so you’ll
need to find the sweet spot yourself.
17.4.2 Properly tagging your images and using imagePullPolicy wisely
You’ll also soon learn that referring to the latest image tag in your pod manifests will
cause problems, because you can’t tell which version of the image each individual pod
replica is running. Even if initially all your pod replicas run the same image version, if
you push a new version of the image under the latest tag, and then pods are resched-
uled (or you scale up your Deployment), the new pods will run the new version,
whereas the old ones will still be running the old one. Also, using the latest tag
makes it impossible to roll back to a previous version (unless you push the old version
of the image again).
 
",[],"[{'entity': 'Kubernetes', 'description': 'Container orchestration system', 'category': 'software'}, {'entity': 'Docker', 'description': 'Containerization platform', 'category': 'software'}, {'entity': 'pod', 'description': 'Lightweight and portable container', 'category': 'container'}, {'entity': 'node', 'description': 'Physical or virtual machine running a pod', 'category': 'hardware'}, {'entity': 'image', 'description': 'Read-only template for creating containers', 'category': 'software'}, {'entity': 'Dockerfile', 'description': 'Script used to build Docker images', 'category': 'software'}, {'entity': 'FROM scratch directive', 'description': 'Instruction in a Dockerfile for creating an empty image', 'category': 'software'}, {'entity': 'ping', 'description': 'Network diagnostic tool', 'category': 'software'}, {'entity': 'dig', 'description': 'DNS lookup tool', 'category': 'software'}, {'entity': 'curl', 'description': 'Tool for transferring data over HTTP', 'category': 'software'}, {'entity': 'imagePullPolicy', 'description': 'Policy for pulling images from a registry', 'category': 'software'}, {'entity': 'latest tag', 'description': 'Tag used to refer to the most recent image version', 'category': 'software'}, {'entity': 'Deployment', 'description': 'Kubernetes resource for managing replicas of a pod', 'category': 'software'}]","[{'source_entity': 'Kubernetes', 'description': 'manages', 'destination_entity': 'pod'}, {'source_entity': 'Kubernetes', 'description': 'orchestrates', 'destination_entity': 'Deployment'}, {'source_entity': 'Kubernetes', 'description': 'deploys', 'destination_entity': 'image'}, {'source_entity': 'Docker', 'description': 'builds', 'destination_entity': 'image'}, {'source_entity': 'Docker', 'description': 'pulls', 'destination_entity': 'FROM scratch directive'}, {'source_entity': 'Kubernetes', 'description': 'uses', 'destination_entity': 'node'}, {'source_entity': 'curl', 'description': 'requests', 'destination_entity': 'image'}, {'source_entity': 'dig', 'description': 'resolves', 'destination_entity': 'latest tag'}, {'source_entity': 'ping', 'description': 'checks', 'destination_entity': 'node'}]","['[\n  {\n    ""source"": ""Kubernetes"",\n    ""destination"": ""pod"",\n    ""relation_description"": ""manages"",\n    ""summary_er"": ""Kubernetes manages pods, ensuring efficient resource allocation and scaling.""\n  }\n]', '[\n  {\n    ""source"": ""Kubernetes"",\n    ""destination"": ""pod"",\n    ""relation_description"": ""orchestrates"",\n    ""summary_er"": ""Kubernetes manages and coordinates the execution of pods, ensuring efficient resource utilization and scalability.""\n  },\n  {\n    ""source"": ""Kubernetes"",\n    ""destination"": ""Deployment"",\n    ""relation_description"": ""manages"",\n    ""summary_er"": ""Kubernetes manages Deployments, which provide a way to rollout new versions of applications with zero downtime and minimal disruption.""\n  }\n]', '[\n  {\n    ""source"": ""Kubernetes"",\n    ""destination"": ""pod"",\n    ""relation_description"": ""deploys"",\n    ""summary_er"": ""Kubernetes deploys a containerized application as a pod, managing its lifecycle and resources.""\n  }\n]', '[\n  {\n    ""source"": ""Docker"",\n    ""destination"": ""pod"",\n    ""relation_description"": ""builds"",\n    ""summary_er"": ""Docker builds an image for a pod, creating a containerized environment for application deployment.""\n  }\n]', '[\n  {\n    ""source"": ""Docker"",\n    ""destination"": ""pod"",\n    ""relation_description"": ""pulls"",\n    ""summary_er"": ""Docker pulls an image from a registry, which is then used to create a pod in Kubernetes.""\n  }\n]', '[\n  {\n    ""source"": ""Kubernetes"",\n    ""destination"": ""pod"",\n    ""relation_description"": ""uses"",\n    ""summary_er"": ""Kubernetes manages and orchestrates containerized applications, utilizing pods as the basic execution unit.""\n  },\n  {\n    ""source"": ""pod"",\n    ""destination"": ""node"",\n    ""relation_description"": ""runs on"",\n    ""summary_er"": ""Pods are scheduled to run on a node within a Kubernetes cluster, leveraging the node\'s resources for execution.""\n  }\n]', '[\n  {\n    ""source"": ""curl"",\n    ""destination"": ""pod"",\n    ""relation_description"": ""requests"",\n    ""summary_er"": ""The curl command sends HTTP requests to a pod, which can be an application or service running in a Kubernetes cluster.""\n  }\n]', '[\n  {\n    ""source"": ""dig"",\n    ""destination"": ""pod"",\n    ""relation_description"": ""resolves"",\n    ""summary_er"": ""The \'dig\' command resolves a DNS query to determine the IP address of a pod with the latest tag.""\n  }\n]', '[\n  {\n    ""source"": ""ping"",\n    ""destination"": ""pod"",\n    ""relation_description"": ""checks"",\n    ""summary_er"": ""The \'ping\' command checks the status of a \'pod\', ensuring it\'s running and responding as expected.""\n  }\n]']","To make apps easy to run and manage in Kubernetes, focus on creating small, minimal container images without unnecessary cruft. This includes using the FROM scratch directive in Dockerfiles and avoiding the latest image tag, which can cause versioning issues. Proper tagging of images and using imagePullPolicy wisely is also crucial to ensure smooth deployment and scaling.","[{'highlight': ""You don't need to modify the code of your app at all to make it easy to run and manage in Kubernetes.""}, {'highlight': 'Including unnecessary files in container images can make them larger than necessary, which can slow down deploying new pods and scaling them.'}, {'highlight': ""Using the FROM scratch directive in the Dockerfile for minimal images can be difficult to debug because they don't include essential tools like ping or curl.""}, {'highlight': ""Referring to the latest image tag in pod manifests can cause problems because it's unclear which version of the image each individual pod replica is running.""}, {'highlight': ""Using a specific image tag instead of 'latest' and configuring imagePullPolicy wisely can help ensure that all pod replicas run the same version of the image.""}]"
441,530,0,[],"498
CHAPTER 17
Best practices for developing apps
 It’s almost mandatory to use tags containing a proper version designator instead
of latest, except maybe in development. Keep in mind that if you use mutable tags
(you push changes to the same tag), you’ll need to set the imagePullPolicy field in
the pod spec to Always. But if you use that in production pods, be aware of the big
caveat associated with it. If the image pull policy is set to Always, the container run-
time will contact the image registry every time a new pod is deployed. This slows
down pod startup a bit, because the node needs to check if the image has been mod-
ified. Worse yet, this policy prevents the pod from starting up when the registry can-
not be contacted.
17.4.3 Using multi-dimensional instead of single-dimensional labels
Don’t forget to label all your resources, not only Pods. Make sure you add multiple
labels to each resource, so they can be selected across each individual dimension. You
(or the ops team) will be grateful you did it when the number of resources increases.
 Labels may include things like
The name of the application (or perhaps microservice) the resource belongs to
Application tier (front-end, back-end, and so on)
Environment (development, QA, staging, production, and so on)
Version
Type of release (stable, canary, green or blue for green/blue deployments, and
so on)
Tenant (if you’re running separate pods for each tenant instead of using name-
spaces)
Shard for sharded systems
This will allow you to manage resources in groups instead of individually and make it
easy to see where each resource belongs.
17.4.4 Describing each resource through annotations
To add additional information to your resources use annotations. At the least,
resources should contain an annotation describing the resource and an annotation
with contact information of the person responsible for it. 
 In a microservices architecture, pods could contain an annotation that lists the
names of the other services the pod is using. This makes it possible to show dependen-
cies between pods. Other annotations could include build and version information
and metadata used by tooling or graphical user interfaces (icon names, and so on).
 Both labels and annotations make managing running applications much easier, but
nothing is worse than when an application starts crashing and you don’t know why.
17.4.5 Providing information on why the process terminated
Nothing is more frustrating than having to figure out why a container terminated
(or is even terminating continuously), especially if it happens at the worst possible
 
",[],"[{'entity': 'tags', 'description': 'container tags with version designator', 'category': 'software'}, {'entity': 'imagePullPolicy', 'description': 'field in pod spec to control image pull', 'category': 'software'}, {'entity': 'latest', 'description': 'tag name for latest container version', 'category': 'software'}, {'entity': 'labels', 'description': 'metadata attached to resources like pods', 'category': 'software'}, {'entity': 'multi-dimensional labels', 'description': 'multiple labels per resource for selection across dimensions', 'category': 'software'}, {'entity': 'annotations', 'description': 'additional metadata attached to resources like pods', 'category': 'software'}, {'entity': 'pods', 'description': 'lightweight and ephemeral containers in Kubernetes', 'category': 'container'}, {'entity': 'containers', 'description': 'processes running within a pod', 'category': 'container'}, {'entity': 'registry', 'description': 'image repository for storing container images', 'category': 'software'}, {'entity': 'Kubernetes', 'description': 'container orchestration system', 'category': 'software'}, {'entity': 'labels', 'description': 'metadata attached to resources like pods', 'category': 'software'}, {'entity': 'annotations', 'description': 'additional metadata attached to resources like pods', 'category': 'software'}]","[{'source_entity': 'registry', 'description': 'stores', 'destination_entity': 'tags'}, {'source_entity': 'registry', 'description': 'manages', 'destination_entity': 'pods'}, {'source_entity': 'registry', 'description': 'pulls', 'destination_entity': 'image'}, {'source_entity': 'registry', 'description': 'pushes', 'destination_entity': 'image'}, {'source_entity': 'Kubernetes', 'description': 'uses', 'destination_entity': 'pods'}, {'source_entity': 'Kubernetes', 'description': 'manages', 'destination_entity': 'containers'}, {'source_entity': 'registry', 'description': 'labels', 'destination_entity': 'multi-dimensional labels'}, {'source_entity': 'registry', 'description': 'sets', 'destination_entity': 'annotations'}, {'source_entity': 'registry', 'description': 'specifies', 'destination_entity': 'imagePullPolicy'}, {'source_entity': 'registry', 'description': 'tags', 'destination_entity': 'latest'}]","['[\n  {\n    ""source"": ""registry"",\n    ""destination"": ""pod"",\n    ""relation_description"": ""stores"",\n    ""summary_er"": ""A container registry stores Docker images for a pod to use.""\n  }\n]', '[\n  {\n    ""source"": ""registry"",\n    ""destination"": ""pod"",\n    ""relation_description"": ""manages"",\n    ""summary_er"": ""The container registry manages a collection of pods, ensuring they are properly configured and running as expected.""\n  }\n]', '[\n  {\n    ""source"": ""registry"",\n    ""destination"": ""pod"",\n    ""relation_description"": ""pulls"",\n    ""summary_er"": ""A container registry pulls an image to create a new pod in Kubernetes.""\n  }\n]', '[\n  {\n    ""source"": ""registry"",\n    ""destination"": ""pod"",\n    ""relation_description"": ""pushes"",\n    ""summary_er"": ""The container registry pushes images to a running pod, allowing for deployment and scaling of applications.""\n  }\n]', '[\n  {\n    ""source"": ""Kubernetes"",\n    ""destination"": ""pod"",\n    ""relation_description"": ""uses"",\n    ""summary_er"": ""Kubernetes manages and orchestrates multiple containers (pods) to ensure efficient resource utilization.""\n  }\n]', '[\n  {\n    ""source"": ""Kubernetes"",\n    ""destination"": ""pod"",\n    ""relation_description"": ""manages"",\n    ""summary_er"": ""Kubernetes manages a collection of containerized applications, referred to as pods.""\n  }\n]', '[\n  {\n    ""source"": ""registry"",\n    ""destination"": ""pod"",\n    ""relation_description"": ""labels"",\n    ""summary_er"": ""A container registry stores metadata about images, including labels that describe their characteristics.""\n  },\n  {\n    ""source"": ""registry"",\n    ""destination"": ""pod"",\n    ""relation_description"": ""multi-dimensional labels"",\n    ""summary_er"": ""A container registry can store complex labels with multiple dimensions to categorize and filter images.""\n  }\n]', '[\n  {\n    ""source"": ""registry"",\n    ""destination"": ""pod"",\n    ""relation_description"": ""sets"",\n    ""summary_er"": ""A Kubernetes registry sets up a pod with specific configurations.""\n  },\n  {\n    ""source"": ""pod"",\n    ""destination"": ""annotations"",\n    ""relation_description"": ""sets"",\n    ""summary_er"": ""A pod sets annotations to store metadata and labels.""\n  }\n]', '[\n  {\n    ""source"": ""registry"",\n    ""destination"": ""pod"",\n    ""relation_description"": ""specifies"",\n    ""summary_er"": ""The registry specifies the location of the container image for a pod, allowing it to be pulled from a remote repository.""\n  }\n]', '[\n  {\n    ""source"": ""Registry"",\n    ""destination"": ""Tags"",\n    ""relation_description"": ""Associated with"",\n    ""summary_er"": ""The registry is associated with a set of tags that describe its contents.""\n  },\n  {\n    ""source"": ""Registry"",\n    ""destination"": ""Pod"",\n    ""relation_description"": ""Pulls from"",\n    ""summary_er"": ""The registry pulls the latest version of a pod from its repository.""\n  },\n  {\n    ""source"": ""Tags"",\n    ""destination"": ""Pod"",\n    ""relation_description"": ""Labels"",\n    ""summary_er"": ""The tags label the pod with metadata that describes its contents.""\n  }\n]']","Use tags with version designators, label resources with multiple dimensions, add annotations for resource descriptions and dependencies. Set imagePullPolicy to Always only in development. Use labels and annotations to manage resources and show dependencies between pods, and include contact information and build/version metadata.","[{'highlight': 'Use tags containing a proper version designator instead of latest, except in development. Set imagePullPolicy field to Always for mutable tags.'}, {'highlight': 'Label all resources with multiple labels across each individual dimension, including application name, tier, environment, version, and type of release.'}, {'highlight': 'Use annotations to add additional information to resources, such as contact information, dependencies between pods, build and version info, and metadata for tooling or GUIs.'}, {'highlight': 'Set imagePullPolicy field to Always can slow down pod startup and prevent pod from starting up when registry cannot be contacted.'}, {'highlight': 'Provide information on why a container terminated through annotations or labels to make it easier to manage running applications.'}]"
