,page,img_cnt,img_npy_lst,text,tables,entities,relationships,summary_rel,summary,highlights
446,535,0,[],"503
Best practices for development and testing
CONNECTING TO THE API SERVER
Similarly, if your app requires access to the Kubernetes API server when running
inside a Kubernetes cluster, it can easily talk to the API server from outside the cluster
during development. If it uses the ServiceAccount’s token to authenticate itself, you
can always copy the ServiceAccount’s Secret’s files to your local machine with kubectl
cp. The API server doesn’t care if the client accessing it is inside or outside the cluster. 
 If the app uses an ambassador container like the one described in chapter 8, you
don’t even need those Secret files. Run kubectl proxy on your local machine, run
your app locally, and it should be ready to talk to your local kubectl proxy (as long as
it and the ambassador container bind the proxy to the same port).
 In this case, you’ll need to make sure the user account your local kubectl is using
has the same privileges as the ServiceAccount the app will run under.
RUNNING INSIDE A CONTAINER EVEN DURING DEVELOPMENT
When during development you absolutely have to run the app in a container for what-
ever reason, there is a way of avoiding having to build the container image every time.
Instead of baking the binaries into the image, you can always mount your local filesys-
tem into the container through Docker volumes, for example. This way, after you
build a new version of the app’s binaries, all you need to do is restart the container (or
not even that, if hot-redeploy is supported). No need to rebuild the image.
17.5.2 Using Minikube in development
As you can see, nothing forces you to run your app inside Kubernetes during develop-
ment. But you may do that anyway to see how the app behaves in a true Kubernetes
environment.
 You may have used Minikube to run examples in this book. Although a Minikube
cluster runs only a single worker node, it’s nevertheless a valuable method of trying
out your app in Kubernetes (and, of course, developing all the resource manifests that
make up your complete application). Minikube doesn’t offer everything that a proper
multi-node Kubernetes cluster usually provides, but in most cases, that doesn’t matter.
MOUNTING LOCAL FILES INTO THE MINIKUBE VM AND THEN INTO YOUR CONTAINERS
When you’re developing with Minikube and you’d like to try out every change to your
app in your Kubernetes cluster, you can mount your local filesystem into the Minikube
VM using the minikube mount command and then mount it into your containers
through a hostPath volume. You’ll find additional instructions on how to do that
in the Minikube documentation at https:/
/github.com/kubernetes/minikube/tree/
master/docs.
USING THE DOCKER DAEMON INSIDE THE MINIKUBE VM TO BUILD YOUR IMAGES
If you’re developing your app with Minikube and planning to build the container
image after every change, you can use the Docker daemon inside the Minikube VM to
do the building, instead of having to build the image through your local Docker dae-
mon, push it to a registry, and then have it pulled by the daemon in the VM. To use
 
",[],"[{'entity': 'Kubernetes', 'description': 'Container orchestration system', 'category': 'software'}, {'entity': 'API server', 'description': 'Server that provides access to Kubernetes resources', 'category': 'software'}, {'entity': 'ServiceAccount', 'description': 'Account used for authentication and authorization in Kubernetes', 'category': 'software'}, {'entity': 'kubectl', 'description': 'Command-line tool for interacting with Kubernetes clusters', 'category': 'software'}, {'entity': 'Docker', 'description': 'Containerization platform', 'category': 'software'}, {'entity': 'container', 'description': 'Lightweight and portable operating system environment', 'category': 'hardware'}, {'entity': 'Minikube', 'description': 'Tool for running a single-node Kubernetes cluster on a local machine', 'category': 'software'}, {'entity': 'cluster', 'description': 'Group of machines that work together to provide computing resources', 'category': 'hardware'}, {'entity': 'node', 'description': 'Individual machine in a cluster', 'category': 'hardware'}, {'entity': 'worker node', 'description': 'Machine in a cluster that runs containers and performs tasks', 'category': 'hardware'}, {'entity': 'resource manifests', 'description': 'Files that define the resources needed by an application', 'category': 'software'}, {'entity': 'Docker daemon', 'description': 'Service that manages Docker containers on a machine', 'category': 'software'}, {'entity': 'registry', 'description': 'Centralized location for storing and managing container images', 'category': 'hardware'}, {'entity': 'hostPath volume', 'description': ""Type of volume that allows access to the host machine's filesystem from within a container"", 'category': 'hardware'}, {'entity': 'Docker volumes', 'description': 'Feature that allows mounting local filesystems into containers', 'category': 'software'}]","[{'source_entity': '""cluster""', 'description': 'manages', 'destination_entity': '""registry""'}, {'source_entity': '""registry""', 'description': 'stores', 'destination_entity': '""Docker volumes""'}, {'source_entity': '""container""', 'description': 'uses', 'destination_entity': '""Docker volumes""'}, {'source_entity': '""kubectl""', 'description': 'interacts with', 'destination_entity': '""cluster""'}, {'source_entity': '""node""', 'description': 'hosts', 'destination_entity': '""container""'}, {'source_entity': '""Docker daemon""', 'description': 'runs', 'destination_entity': '""container""'}, {'source_entity': '""worker node""', 'description': 'executes', 'destination_entity': '""resource manifests""'}, {'source_entity': '""hostPath volume""', 'description': 'provides', 'destination_entity': '""Docker volumes""'}, {'source_entity': '""kubectl""', 'description': 'deploys', 'destination_entity': '""container""'}, {'source_entity': '""API server""', 'description': 'communicates with', 'destination_entity': '""ServiceAccount""'}, {'source_entity': '""ServiceAccount""', 'description': 'authenticates', 'destination_entity': '""API server""'}]","['[\n  {\n    ""source"": ""cluster"",\n    ""destination"": ""pod"",\n    ""relation_description"": ""manages"",\n    ""summary_er"": ""A cluster manages a collection of pods, ensuring they run smoothly and efficiently.""\n  },\n  {\n    ""source"": ""registry"",\n    ""destination"": ""image"",\n    ""relation_description"": ""stores"",\n    ""summary_er"": ""A registry stores images, making them easily accessible for deployment in containers.""\n  }\n]', '[\n  {\n    ""source"": ""registry"",\n    ""destination"": ""pod"",\n    ""relation_description"": ""stores"",\n    ""summary_er"": ""A Docker registry stores container images, which can then be deployed to a pod for execution.""\n  },\n  {\n    ""source"": ""Docker volumes"",\n    ""destination"": ""pod"",\n    ""relation_description"": ""mounts"",\n    ""summary_er"": ""A Docker volume mounts a directory from the host machine into a pod, providing persistent storage.""\n  }\n]', '[{""source"": ""container"", ""destination"": ""pod"", ""relation_description"": ""uses"", ""summary_er"": ""A container uses a pod to run its application.""}, {""source"": ""Docker volumes"", ""destination"": ""container"", ""relation_description"": ""mounts"", ""summary_er"": ""A Docker volume mounts a file system to a container for persistent storage.""}]', '[\n  {\n    ""source"": ""kubectl"",\n    ""destination"": ""pod"",\n    ""relation_description"": ""interacts with"",\n    ""summary_er"": ""\\""Kubectl\\"" manages and controls containerized applications and services, interacting directly with \\""pods\\"", which are the basic execution unit in a Kubernetes cluster.""\n  },\n  {\n    ""source"": ""kubectl"",\n    ""destination"": ""cluster"",\n    ""relation_description"": ""manages"",\n    ""summary_er"": ""\\""Kubectl\\"" is used to manage and control containerized applications and services within a \\""cluster\\"", which is a group of machines that work together as one system.""\n  }\n]', '[\n  {\n    ""source"": ""node"",\n    ""destination"": ""pod"",\n    ""relation_description"": ""hosts"",\n    ""summary_er"": ""A node in a Kubernetes cluster hosts one or more pods, which are the basic execution units of a containerized application.""\n  },\n  {\n    ""source"": ""pod"",\n    ""destination"": ""container"",\n    ""relation_description"": ""container"",\n    ""summary_er"": ""A pod in a Kubernetes cluster contains one or more containers, which are isolated processes that run an application.""\n  }\n]', '[\n  {\n    ""source"": ""Docker daemon"",\n    ""destination"": ""pod"",\n    ""relation_description"": ""runs"",\n    ""summary_er"": ""The Docker daemon executes containers within a pod, utilizing its resources for efficient operation.""\n  }\n]', '[\n  {\n    ""source"": ""worker node"",\n    ""destination"": ""pod"",\n    ""relation_description"": ""executes"",\n    ""summary_er"": ""A worker node in a Kubernetes cluster executes a pod, which is a containerized application that can run multiple containers.""\n  }\n]', '[\n  {\n    ""source"": ""hostPath volume"",\n    ""destination"": ""pod"",\n    ""relation_description"": ""provides"",\n    ""summary_er"": ""A hostPath volume provides a directory on the host machine to a pod for data storage.""\n  }\n]', '[\n  {\n    ""source"": ""kubectl"",\n    ""destination"": ""pod"",\n    ""relation_description"": ""deploys"",\n    ""summary_er"": ""Kubernetes command-line tool (kubectl) deploys a containerized application to a pod, managing its lifecycle and resources.""\n  }\n]', '[\n  {\n    ""source"": ""API server"",\n    ""destination"": ""pod"",\n    ""relation_description"": ""communicates with"",\n    ""summary_er"": ""The API server interacts with a pod to provide services and manage network traffic.""\n  },\n  {\n    ""source"": ""ServiceAccount"",\n    ""destination"": ""pod"",\n    ""relation_description"": ""communicates with"",\n    ""summary_er"": ""A ServiceAccount authenticates and authorizes interactions between pods, enabling secure communication and resource access.""\n  }\n]', '[\n  {\n    ""source"": ""ServiceAccount"",\n    ""destination"": ""Pod"",\n    ""relation_description"": ""authenticates"",\n    ""summary_er"": ""A ServiceAccount authenticates a Pod by verifying its identity, ensuring only authorized access to cluster resources.""\n  }\n]']","When developing an app that requires access to the Kubernetes API server, you can easily talk to the API server from outside the cluster during development using ServiceAccount's token or ambassador container. Alternatively, you can run your app inside a Kubernetes cluster using Minikube, which provides a single worker node but is valuable for trying out your app in Kubernetes and developing resource manifests. You can also mount local files into the Minikube VM and containers using hostPath volume or use the Docker daemon inside the Minikube VM to build container images.","[{'highlight': ""You can easily talk to the Kubernetes API server from outside the cluster during development using the ServiceAccount's token or an ambassador container.""}, {'highlight': 'When developing with Minikube, you can mount your local filesystem into the Minikube VM and then into your containers through a hostPath volume.'}, {'highlight': ""You don't need to rebuild the Docker image every time during development; instead, you can mount your local filesytem into the container using Docker volumes.""}, {'highlight': 'Minikube is a valuable method of trying out your app in Kubernetes and developing resource manifests for your complete application.'}, {'highlight': 'You can use the Docker daemon inside the Minikube VM to build your images instead of building through your local Docker daemon and pushing to a registry.'}]"
447,536,0,[],"504
CHAPTER 17
Best practices for developing apps
Minikube’s Docker daemon, all you need to do is point your DOCKER_HOST environ-
ment variable to it. Luckily, this is much easier than it sounds. All you need to do is
run the following command on your local machine:
$ eval $(minikube docker-env)
This will set all the required environment variables for you. You then build your
images the same way as if the Docker daemon was running on your local machine.
After you build the image, you don’t need to push it anywhere, because it’s already
stored locally on the Minikube VM, which means new pods can use the image immedi-
ately. If your pods are already running, you either need to delete them or kill their
containers so they’re restarted.
BUILDING IMAGES LOCALLY AND COPYING THEM OVER TO THE MINIKUBE VM DIRECTLY
If you can’t use the daemon inside the VM to build the images, you still have a way to
avoid having to push the image to a registry and have the Kubelet running in the
Minikube VM pull it. If you build the image on your local machine, you can copy it
over to the Minikube VM with the following command:
$ docker save <image> | (eval $(minikube docker-env) && docker load)
As before, the image is immediately ready to be used in a pod. But make sure the
imagePullPolicy in your pod spec isn’t set to Always, because that would cause the
image to be pulled from the external registry again and you’d lose the changes you’ve
copied over.
COMBINING MINIKUBE WITH A PROPER KUBERNETES CLUSTER
You have virtually no limit when developing apps with Minikube. You can even com-
bine a Minikube cluster with a proper Kubernetes cluster. I sometimes run my devel-
opment workloads in my local Minikube cluster and have them talk to my other
workloads that are deployed in a remote multi-node Kubernetes cluster thousands of
miles away. 
 Once I’m finished with development, I can move my local workloads to the remote
cluster with no modifications and with absolutely no problems thanks to how Kuber-
netes abstracts away the underlying infrastructure from the app.
17.5.3 Versioning and auto-deploying resource manifests
Because Kubernetes uses a declarative model, you never have to figure out the current
state of your deployed resources and issue imperative commands to bring that state to
what you desire. All you need to do is tell Kubernetes your desired state and it will take
all the necessary actions to reconcile the cluster state with the desired state.
 You can store your collection of resource manifests in a Version Control System,
enabling you to perform code reviews, keep an audit trail, and roll back changes
whenever necessary. After each commit, you can run the kubectl apply command to
have your changes reflected in your deployed resources. 
 
",[],"[{'entity': 'Minikube', 'description': 'A tool for running Kubernetes locally on a machine.', 'category': 'software'}, {'entity': 'DOCKER_HOST', 'description': 'An environment variable that points to the Docker daemon.', 'category': 'environment variable'}, {'entity': 'minikube docker-env', 'description': 'A command that sets up the environment variables for Minikube.', 'category': 'command'}, {'entity': 'Docker daemon', 'description': 'The process that runs on a machine to manage Docker containers.', 'category': 'process'}, {'entity': 'imagePullPolicy', 'description': 'A field in a pod spec that determines how the image is pulled from a registry.', 'category': 'field'}, {'entity': 'Always', 'description': 'A value for the imagePullPolicy field that causes the image to be pulled from an external registry.', 'category': 'value'}, {'entity': 'Kubelet', 'description': 'The component of Kubernetes that runs on a machine and manages pods.', 'category': 'component'}, {'entity': 'kubectl apply', 'description': 'A command that applies changes to deployed resources in a Kubernetes cluster.', 'category': 'command'}, {'entity': 'Version Control System', 'description': 'A system for storing and managing code, such as Git or SVN.', 'category': 'system'}, {'entity': 'resource manifests', 'description': 'The files that define the desired state of resources in a Kubernetes cluster.', 'category': 'file'}, {'entity': 'Kubernetes', 'description': 'An open-source container orchestration system.', 'category': 'software'}]","[{'source_entity': '""kubectl apply""', 'description': 'applies configuration to', 'destination_entity': '""Version Control System""'}, {'source_entity': '""kubectl apply""', 'description': 'configures', 'destination_entity': '""Kubernetes""'}, {'source_entity': '""minikube docker-env""', 'description': 'sets environment variables for', 'destination_entity': '""Docker daemon""'}, {'source_entity': '""minikube docker-env""', 'description': 'configures', 'destination_entity': '""Kubernetes""'}, {'source_entity': '""Kubelet""', 'description': 'pulls images from', 'destination_entity': '""Docker daemon""'}, {'source_entity': '""imagePullPolicy""', 'description': 'specifies policy for pulling', 'destination_entity': '""images""'}, {'source_entity': '""DOCKER_HOST""', 'description': 'sets host for', 'destination_entity': '""Docker daemon""'}, {'source_entity': '""minikube docker-env""', 'description': 'generates environment variables for', 'destination_entity': '""resource manifests""'}]","['[\n  {\n    ""source"": ""kubectl"",\n    ""destination"": ""pod"",\n    ""relation_description"": ""applies configuration to"",\n    ""summary_er"": ""Kubectl applies configuration to a running pod, ensuring it meets the desired state.""\n  },\n  {\n    ""source"": ""Version Control System"",\n    ""destination"": null,\n    ""relation_description"": null,\n    ""summary_er"": ""A Version Control System is a software tool that helps manage changes to code over time, tracking revisions and collaborations among developers.""\n  }\n]', '[\n  {\n    ""source"": ""kubectl apply"",\n    ""destination"": ""pod"",\n    ""relation_description"": ""configures"",\n    ""summary_er"": ""The \'kubectl apply\' command configures a Kubernetes pod by applying configuration settings to it.""\n  }\n]', '[\n  {\n    ""source"": ""minikube"",\n    ""destination"": ""pod"",\n    ""relation_description"": ""sets environment variables for"",\n    ""summary_er"": ""Minikube sets environment variables to interact with a pod in a Kubernetes cluster.""\n  },\n  {\n    ""source"": ""Docker daemon"",\n    ""destination"": ""container"",\n    ""relation_description"": ""runs and manages"",\n    ""summary_er"": ""The Docker daemon runs and manages containers, providing a runtime environment for applications.""\n  }\n]', '[\n  {\n    ""source"": ""minikube"",\n    ""destination"": ""pod"",\n    ""relation_description"": ""configures"",\n    ""summary_er"": ""Minikube configures a Kubernetes pod to run Docker containers.""\n  }\n]', '[\n  {\n    ""source"": ""Kubelet"",\n    ""destination"": ""pod"",\n    ""relation_description"": ""pulls images from"",\n    ""summary_er"": ""Kubelet pulls container images from Docker daemon to deploy on a pod.""\n  },\n  {\n    ""source"": ""Docker daemon"",\n    ""destination"": ""Kubelet"",\n    ""relation_description"": ""pushes images to"",\n    ""summary_er"": ""Docker daemon pushes container images to Kubelet for deployment on a pod.""\n  }\n]', '[\n  {\n    ""source"": ""imagePullPolicy"",\n    ""destination"": ""pod"",\n    ""relation_description"": ""specifies policy for pulling"",\n    ""summary_er"": ""Image pull policy determines how a container image is pulled from a registry, affecting pod deployment and security.""\n  },\n  {\n    ""source"": ""images"",\n    ""destination"": ""pod"",\n    ""relation_description"": ""container images"",\n    ""summary_er"": ""Images are used to create containers for pods, providing the necessary software and dependencies for execution.""\n  }\n]', '[\n  {\n    ""source"": ""DOCKER_HOST"",\n    ""destination"": ""pod"",\n    ""relation_description"": ""sets host for"",\n    ""summary_er"": ""The Docker Host variable sets the host for a pod, allowing it to communicate with the Docker daemon.""\n  }\n]', '[\n  {\n    ""source"": ""minikube"",\n    ""destination"": ""docker-env"",\n    ""relation_description"": ""generates environment variables for"",\n    ""summary_er"": ""Minikube generates Docker environment variables to interact with a running Minikube cluster.""\n  },\n  {\n    ""source"": ""resource manifests"",\n    ""destination"": ""pod"",\n    ""relation_description"": ""related to"",\n    ""summary_er"": ""Resource manifests are related to pods in Kubernetes, defining the resources required by each pod.""\n  }\n]']","Minikube allows developers to build apps locally without pushing images to a registry. Environment variables can be set using ""eval $(minikube docker-env)"" to use the Minikube VM's Docker daemon. Images can also be built locally and copied over to the Minikube VM, or combined with a proper Kubernetes cluster for development and deployment.","[{'highlight': ""To use Minikube's Docker daemon, set the DOCKER_HOST environment variable by running $ eval $(minikube docker-env) on your local machine.""}, {'highlight': 'You can build images locally and copy them over to the Minikube VM using the command $ docker save <image> | (eval $(minikube docker-env) && docker load).'}, {'highlight': 'When combining Minikube with a proper Kubernetes cluster, you can develop apps on your local Minikube cluster and deploy them to a remote multi-node cluster without modifications.'}, {'highlight': 'Kubernetes uses a declarative model, so you only need to tell it your desired state, and it will take the necessary actions to reconcile the cluster state with the desired state using kubectl apply command.'}, {'highlight': 'You can store resource manifests in a Version Control System, enabling code reviews, audit trails, and rolling back changes whenever necessary.'}]"
