,page,img_cnt,img_npy_lst,text,tables,entities,relationships,summary_rel,summary,highlights
444,533,0,[],"501
Making your apps easy to run and manage in Kubernetes
This copies the file localfile to /etc/remotefile inside the pod’s container. If the pod has
more than one container, you specify the container using the -c containerName option.
USING CENTRALIZED LOGGING
In a production system, you’ll want to use a centralized, cluster-wide logging solution,
so all your logs are collected and (permanently) stored in a central location. This
allows you to examine historical logs and analyze trends. Without such a system, a
pod’s logs are only available while the pod exists. As soon as it’s deleted, its logs are
deleted also. 
 Kubernetes by itself doesn’t provide any kind of centralized logging. The compo-
nents necessary for providing a centralized storage and analysis of all the container
logs must be provided by additional components, which usually run as regular pods in
the cluster. 
 Deploying centralized logging solutions is easy. All you need to do is deploy a few
YAML/JSON manifests and you’re good to go. On Google Kubernetes Engine, it’s
even easier. Check the Enable Stackdriver Logging checkbox when setting up the clus-
ter. Setting up centralized logging on an on-premises Kubernetes cluster is beyond the
scope of this book, but I’ll give you a quick overview of how it’s usually done.
 You may have already heard of the ELK stack composed of ElasticSearch, Logstash,
and Kibana. A slightly modified variation is the EFK stack, where Logstash is replaced
with FluentD. 
 When using the EFK stack for centralized logging, each Kubernetes cluster node
runs a FluentD agent (usually as a pod deployed through a DaemonSet), which is
responsible for gathering the logs from the containers, tagging them with pod-specific
information, and delivering them to ElasticSearch, which stores them persistently.
ElasticSearch is also deployed as a pod somewhere in the cluster. The logs can then be
viewed and analyzed in a web browser through Kibana, which is a web tool for visualiz-
ing ElasticSearch data. It also usually runs as a pod and is exposed through a Service.
The three components of the EFK stack are shown in the following figure.
NOTE
In the next chapter, you’ll learn about Helm charts. You can use charts
created by the Kubernetes community to deploy the EFK stack instead of cre-
ating your own YAML manifests. 
Node 1
Container logs
Kibana
Web
browser
FluentD
Node 2
Container logs
FluentD
Node 3
Container logs
FluentD
ElasticSearch
Figure 17.10
Centralized logging with FluentD, ElasticSearch, and Kibana
 
",[],"[{'entity': 'Kubernetes', 'description': 'container orchestration system', 'category': 'software'}, {'entity': 'pod', 'description': 'lightweight and portable container', 'category': 'application'}, {'entity': 'container', 'description': 'isolated process with its own resources', 'category': 'process'}, {'entity': 'file', 'description': 'data stored on disk', 'category': 'hardware'}, {'entity': 'logging', 'description': 'process of recording events and errors', 'category': 'application'}, {'entity': 'centralized logging', 'description': 'system for collecting and storing logs in a central location', 'category': 'software'}, {'entity': 'cluster-wide logging', 'description': 'system for collecting and storing logs across multiple nodes', 'category': 'software'}, {'entity': 'YAML/JSON manifests', 'description': 'configuration files used to deploy applications', 'category': 'software'}, {'entity': 'Google Kubernetes Engine', 'description': 'managed container orchestration service', 'category': 'cloud service'}, {'entity': 'ELK stack', 'description': 'collection of tools for logging and analytics', 'category': 'software'}, {'entity': 'EFK stack', 'description': 'modified version of ELK stack using FluentD instead of Logstash', 'category': 'software'}, {'entity': 'FluentD', 'description': 'logging agent that collects and processes logs', 'category': 'application'}, {'entity': 'ElasticSearch', 'description': 'search and analytics engine for log data', 'category': 'database'}, {'entity': 'Kibana', 'description': 'web interface for visualizing ElasticSearch data', 'category': 'application'}, {'entity': 'DaemonSet', 'description': 'deployment strategy that ensures a pod is running on every node', 'category': 'software'}, {'entity': 'Service', 'description': ' abstraction layer for accessing applications', 'category': 'networking'}]","[{'source_entity': '""Google Kubernetes Engine""', 'description': 'provides', 'destination_entity': '""cluster-wide logging""'}, {'source_entity': '""DaemonSet""', 'description': 'implements', 'destination_entity': '""FluentD""'}, {'source_entity': '""FluentD""', 'description': 'collects', 'destination_entity': '""logging""'}, {'source_entity': '""Service""', 'description': 'exposes', 'destination_entity': '""logging""'}, {'source_entity': '""centralized logging""', 'description': 'integrates', 'destination_entity': '""container""'}, {'source_entity': '""ElasticSearch""', 'description': 'stores', 'destination_entity': '""logging""'}, {'source_entity': '""ELK stack""', 'description': 'includes', 'destination_entity': '""ElasticSearch""'}, {'source_entity': '""EFK stack""', 'description': 'extends', 'destination_entity': '""ELK stack""'}, {'source_entity': '""Kibana""', 'description': 'visualizes', 'destination_entity': '""logging""'}, {'source_entity': '""Kubernetes""', 'description': 'manages', 'destination_entity': '""pod""'}, {'source_entity': '""YAML/JSON manifests""', 'description': 'defines', 'destination_entity': '""pod""'}]","['[\n  {\n    ""source"": ""Google Kubernetes Engine"",\n    ""destination"": ""pod"",\n    ""relation_description"": ""provides"",\n    ""summary_er"": ""Google Kubernetes Engine provides a managed environment for running pods, enabling cluster-wide logging and other features.""\n  }\n]', '[\n  {\n    ""source"": ""DaemonSet"",\n    ""destination"": ""pod"",\n    ""relation_description"": ""implements"",\n    ""summary_er"": ""A DaemonSet ensures a specified number of replicas (pods) are running at any given time, in this case implementing FluentD.""\n  }\n]', '[\n  {\n    ""source"": ""FluentD"",\n    ""destination"": ""pod logging"",\n    ""relation_description"": ""collects"",\n    ""summary_er"": ""FluentD collects logs from various sources and stores them in a pod named \'logging\'.""\n  }\n]', '[\n  {\n    ""source"": ""Service"",\n    ""destination"": ""Pod"",\n    ""relation_description"": ""exposes"",\n    ""summary_er"": ""A Service in Kubernetes exposes a Pod\'s port to the outside world, allowing external traffic to reach the Pod.""\n  },\n  {\n    ""source"": ""Service"",\n    ""destination"": ""logging"",\n    ""relation_description"": ""related to"",\n    ""summary_er"": ""Logging is related to Services in Kubernetes as it helps monitor and troubleshoot Service-related issues.""\n  }\n]', '[\n  {\n    ""source"": ""centralized logging"",\n    ""destination"": ""pod"",\n    ""relation_description"": ""integrates"",\n    ""summary_er"": ""Centralized logging integrates with pods to collect and manage logs from containerized applications.""\n  }\n]', '[\n  {\n    ""source"": ""ElasticSearch"",\n    ""destination"": ""pod logging"",\n    ""relation_description"": ""stores"",\n    ""summary_er"": ""ElasticSearch stores logs in a pod named logging.""\n  }\n]', '[\n  {\n    ""source"": ""ELK stack"",\n    ""destination"": ""pod"",\n    ""relation_description"": ""includes"",\n    ""summary_er"": ""The ELK stack includes a pod that runs Elasticsearch, a popular search and analytics engine.""\n  },\n  {\n    ""source"": ""ElasticSearch"",\n    ""destination"": ""pod"",\n    ""relation_description"": ""runs on"",\n    ""summary_er"": ""Elasticsearch is a search and analytics engine that can run as a standalone pod in a Kubernetes cluster.""\n  }\n]', '[\n  {\n    ""source"": ""EFK stack"",\n    ""destination"": ""ELK stack"",\n    ""relation_description"": ""extends"",\n    ""summary_er"": ""The EFK stack extends the ELK stack by adding Docker and Kubernetes capabilities.""\n  }\n]', '[\n  {\n    ""source"": ""Kibana"",\n    ""destination"": ""pod"",\n    ""relation_description"": ""visualizes"",\n    ""summary_er"": ""Kibana visualizes data from logging pods, providing real-time insights and analytics.""\n  }\n]', '[\n  {\n    ""source"": ""Kubernetes"",\n    ""destination"": ""pod"",\n    ""relation_description"": ""manages"",\n    ""summary_er"": ""Kubernetes manages pods by orchestrating their creation, scaling, and termination to ensure efficient resource utilization.""\n  }\n]', '[\n  {\n    ""source"": ""YAML/JSON manifests"",\n    ""destination"": ""pod"",\n    ""relation_description"": ""defines"",\n    ""summary_er"": ""YAML/JSON manifests define the configuration for a Kubernetes pod, specifying its properties and behavior.""\n  }\n]']","Kubernetes provides no centralized logging by itself, requiring additional components to store and analyze container logs. Deploying a centralized logging solution like the EFK stack (FluentD, ElasticSearch, Kibana) is easy through YAML/JSON manifests or Helm charts, allowing for historical log examination and trend analysis.","[{'highlight': 'Kubernetes by itself doesn’t provide any kind of centralized logging.'}, {'highlight': 'Deploying centralized logging solutions is easy. All you need to do is deploy a few YAML/JSON manifests and you’re good to go.'}, {'highlight': 'When using the EFK stack for centralized logging, each Kubernetes cluster node runs a FluentD agent (usually as a pod deployed through a DaemonSet), which is responsible for gathering the logs from the containers,'}, {'highlight': 'ElasticSearch is also deployed as a pod somewhere in the cluster. The logs can then be viewed and analyzed in a web browser through Kibana, which is a web tool for visualizing ElasticSearch data.'}, {'highlight': 'You may have already heard of the ELK stack composed of ElasticSearch, Logstash, and Kibana. A slightly modified variation is the EFK stack, where Logstash is replaced with FluentD.'}]"
445,534,0,[],"502
CHAPTER 17
Best practices for developing apps
HANDLING MULTI-LINE LOG STATEMENTS
The FluentD agent stores each line of the log file as an entry in the ElasticSearch
data store. There’s one problem with that. Log statements spanning multiple lines,
such as exception stack traces in Java, appear as separate entries in the centralized
logging system. 
 To solve this problem, you can have the apps output JSON instead of plain text.
This way, a multiline log statement can be stored and shown in Kibana as a single
entry. But that makes viewing logs with kubectl logs much less human-friendly. 
 The solution may be to keep outputting human-readable logs to standard output,
while writing JSON logs to a file and having them processed by FluentD. This requires
configuring the node-level FluentD agent appropriately or adding a logging sidecar
container to every pod. 
17.5
Best practices for development and testing
We’ve talked about what to be mindful of when developing apps, but we haven’t
talked about the development and testing workflows that will help you streamline
those processes. I don’t want to go into too much detail here, because everyone needs
to find what works best for them, but here are a few starting points.
17.5.1 Running apps outside of Kubernetes during development
When you’re developing an app that will run in a production Kubernetes cluster, does
that mean you also need to run it in Kubernetes during development? Not really. Hav-
ing to build the app after each minor change, then build the container image, push it
to a registry, and then re-deploy the pods would make development slow and painful.
Luckily, you don’t need to go through all that trouble.
 You can always develop and run apps on your local machine, the way you’re used
to. After all, an app running in Kubernetes is a regular (although isolated) process
running on one of the cluster nodes. If the app depends on certain features the
Kubernetes environment provides, you can easily replicate that environment on your
development machine.
 I’m not even talking about running the app in a container. Most of the time, you
don’t need that—you can usually run the app directly from your IDE. 
CONNECTING TO BACKEND SERVICES
In production, if the app connects to a backend Service and uses the BACKEND_SERVICE
_HOST and BACKEND_SERVICE_PORT environment variables to find the Service’s coordi-
nates, you can obviously set those environment variables on your local machine manu-
ally and point them to the backend Service, regardless of if it’s running outside or
inside a Kubernetes cluster. If it’s running inside Kubernetes, you can always (at least
temporarily) make the Service accessible externally by changing it to a NodePort or a
LoadBalancer-type Service. 
 
",[],"[{'entity': 'FluentD', 'description': 'The FluentD agent stores each line of the log file as an entry in the ElasticSearch data store.', 'category': 'software'}, {'entity': 'ElasticSearch', 'description': 'A centralized logging system where FluentD stores log entries.', 'category': 'database'}, {'entity': 'Kibana', 'description': 'A tool for viewing logs stored in ElasticSearch.', 'category': 'application'}, {'entity': 'kubectl', 'description': 'A command-line tool for managing Kubernetes resources, including viewing logs.', 'category': 'software'}, {'entity': 'JSON', 'description': 'A data format used to store log statements instead of plain text.', 'category': 'data format'}, {'entity': 'Java', 'description': 'A programming language where exception stack traces can span multiple lines.', 'category': 'programming language'}, {'entity': 'Kubernetes', 'description': 'An environment for running containerized applications, including development and production clusters.', 'category': 'container orchestration system'}, {'entity': 'node-level FluentD agent', 'description': 'A configuration of the FluentD agent on a node to process JSON logs.', 'category': 'software'}, {'entity': 'logging sidecar container', 'description': 'A container that processes JSON logs and writes them to a file.', 'category': 'container'}, {'entity': 'IDE', 'description': 'An Integrated Development Environment where developers can run apps directly without containers.', 'category': 'application'}, {'entity': 'BACKEND_SERVICE_HOST', 'description': 'An environment variable used to find the coordinates of a backend Service.', 'category': 'environment variable'}, {'entity': 'BACKEND_SERVICE_PORT', 'description': 'An environment variable used to find the port number of a backend Service.', 'category': 'environment variable'}]","[{'source_entity': '""BACKEND_SERVICE_HOST""', 'description': 'is used to configure', 'destination_entity': '""FluentD""'}, {'source_entity': '""FluentD""', 'description': 'collects and processes logs from', 'destination_entity': '""logging sidecar container""'}, {'source_entity': '""kubectl""', 'description': 'is used to manage and deploy', 'destination_entity': '""Kubernetes""'}, {'source_entity': '""node-level FluentD agent""', 'description': 'sends logs to', 'destination_entity': '""ElasticSearch""'}, {'source_entity': '""IDE""', 'description': 'is used for development and debugging of', 'destination_entity': '""Java""'}, {'source_entity': '""Kubernetes""', 'description': 'uses', 'destination_entity': '""BACKEND_SERVICE_PORT""'}, {'source_entity': '""Kibana""', 'description': 'is used to visualize and analyze data from', 'destination_entity': '""ElasticSearch""'}, {'source_entity': '""JSON""', 'description': 'is used as a format for logging and configuration of', 'destination_entity': '""FluentD""'}]","['[{\n    ""source"": ""BACKEND_SERVICE_HOST"",\n    ""destination"": ""pod"",\n    ""relation_description"": ""is used to configure"",\n    ""summary_er"": ""The BACKEND_SERVICE_HOST is used to configure a pod.""\n}]', '[\n  {\n    ""source"": ""FluentD"",\n    ""destination"": ""logging sidecar container"",\n    ""relation_description"": ""collects and processes logs from"",\n    ""summary_er"": ""FluentD collects logs from logging sidecar container to process them.""\n  }\n]', '[\n  {\n    ""source"": ""kubectl"",\n    ""destination"": ""pod"",\n    ""relation_description"": ""is used to manage and deploy"",\n    ""summary_er"": ""kubectl is a command-line tool for managing Kubernetes resources, including deploying and managing pods.""\n  }\n]', '[\n  {\n    ""source"": ""node-level FluentD agent"",\n    ""destination"": ""ElasticSearch"",\n    ""relation_description"": ""sends logs to"",\n    ""summary_er"": ""The node-level FluentD agent forwards log data to the ElasticSearch pod for storage and analysis.""\n  }\n]', '[\n  {\n    ""source"": ""IDE"",\n    ""destination"": ""Pod"",\n    ""relation_description"": ""is used for development and debugging of"",\n    ""summary_er"": ""An Integrated Development Environment (IDE) is used to develop, debug, and deploy software applications in a containerized environment, specifically within a Kubernetes Pod.""\n  }\n]', '[\n  {\n    ""source"": ""Kubernetes"",\n    ""destination"": ""pod"",\n    ""relation_description"": ""uses"",\n    ""summary_er"": ""Kubernetes manages and orchestrates containerized applications, including pods, which are the basic execution unit in a Kubernetes cluster.""\n  }\n]', '[\n  {\n    ""source"": ""Kibana"",\n    ""destination"": ""ElasticSearch"",\n    ""relation_description"": ""is used to visualize and analyze data from"",\n    ""summary_er"": ""Kibana leverages ElasticSearch for data visualization and analysis, utilizing its capabilities to provide insights.""\n  }\n]', '[\n  {\n    ""source"": ""Kubernetes"",\n    ""destination"": ""Pod"",\n    ""relation_description"": ""is used to manage"",\n    ""summary_er"": ""Kubernetes is used to manage and orchestrate containers, including pods, which are the basic execution unit of a containerized application.""\n  },\n  {\n    ""source"": ""Docker"",\n    ""destination"": ""Container"",\n    ""relation_description"": ""is used to package"",\n    ""summary_er"": ""Docker is used to package applications and their dependencies into a single container that can be run on any system with Docker installed.""\n  },\n  {\n    ""source"": ""JSON"",\n    ""destination"": ""FluentD"",\n    ""relation_description"": ""is used as a format for logging and configuration of"",\n    ""summary_er"": ""JSON is used as a format for logging and configuration of FluentD, which collects, processes, and forwards log data to various destinations.""\n  },\n  {\n    ""source"": ""Machine Learning"",\n    ""destination"": ""Generative AI"",\n    ""relation_description"": ""is related to"",\n    ""summary_er"": ""Machine learning is related to generative AI, which uses algorithms to generate new content, such as images or text, that resembles existing data.""\n  },\n  {\n    ""source"": ""Natural Language Understanding"",\n    ""destination"": ""Computer Vision"",\n    ""relation_description"": ""is complementary to"",\n    ""summary_er"": ""Natural language understanding is complementary to computer vision, which enables machines to interpret and understand visual information from images and videos.""\n  }\n]']","The chapter discusses best practices for developing apps in Kubernetes. It highlights the importance of handling multi-line log statements by outputting JSON logs instead of plain text, which can be stored and shown as a single entry in Kibana. The solution is to keep outputting human-readable logs while writing JSON logs to a file and having them processed by FluentD. Additionally, it suggests running apps outside of Kubernetes during development on local machines or IDEs without the need for containerization. It also advises connecting to backend services manually or temporarily making them accessible externally using NodePort or LoadBalancer-type Services.","[{'highlight': 'The FluentD agent stores each line of the log file as an entry in the ElasticSearch data store, but this can cause issues with multiline log statements.'}, {'highlight': 'Developing and running apps on a local machine during development is a viable option, allowing for faster iteration without the need to build and deploy containers.'}, {'highlight': 'Connecting to backend services in production can be achieved by setting environment variables on a local machine or temporarily exposing a Service externally via NodePort or LoadBalancer-type Service.'}, {'highlight': 'Outputting JSON logs instead of plain text can help solve the issue with multiline log statements, but this may make viewing logs with kubectl logs less human-friendly.'}, {'highlight': 'Configuring the node-level FluentD agent or adding a logging sidecar container to every pod is required to process JSON logs and keep outputting human-readable logs to standard output.'}]"
