,page,img_cnt,img_npy_lst,text,tables,entities,relationships,summary_rel,summary,highlights
437,526,0,[],"494
CHAPTER 17
Best practices for developing apps
In the A sequence of events, you’ll see that as soon as the Kubelet receives the notifica-
tion that the pod should be terminated, it initiates the shutdown sequence as explained
in section 17.2.5 (run the pre-stop hook, send SIGTERM, wait for a period of time, and
then forcibly kill the container if it hasn’t yet terminated on its own). If the app
responds to the SIGTERM by immediately ceasing to receive client requests, any client
trying to connect to it will receive a Connection Refused error. The time it takes for
this to happen from the time the pod is deleted is relatively short because of the direct
path from the API server to the Kubelet.
 Now, let’s look at what happens in the other sequence of events—the one leading
up to the pod being removed from the iptables rules (sequence B in the figure).
When the Endpoints controller (which runs in the Controller Manager in the Kuber-
netes Control Plane) receives the notification of the Pod being deleted, it removes
the pod as an endpoint in all services that the pod is a part of. It does this by modify-
ing the Endpoints API object by sending a REST request to the API server. The API
server then notifies all clients watching the Endpoints object. Among those watchers
are all the kube-proxies running on the worker nodes. Each of these proxies then
updates the iptables rules on its node, which is what prevents new connections
from being forwarded to the terminating pod. An important detail here is that
removing the iptables rules has no effect on existing connections—clients who are
already connected to the pod will still send additional requests to the pod through
those existing connections.
 Both of these sequences of events happen in parallel. Most likely, the time it takes
to shut down the app’s process in the pod is slightly shorter than the time required for
the iptables rules to be updated. The chain of events that leads to iptables rules
being updated is considerably longer (see figure 17.8), because the event must first
reach the Endpoints controller, which then sends a new request to the API server, and
A2. Send
SIGTERM
API server
API server
Kubelet
Endpoints
controller
Container(s)
A1. Watch
notiﬁcation
(pod modiﬁed)
B1. Watch
notiﬁcation
(pod modiﬁed)
B2. Remove pod’s IP
from endpoints
kube-proxy
B4. Update
iptables
rules
iptables
kube-proxy
iptables
Time
B3. Watch notiﬁcation
(endpoints changed)
Figure 17.8
Timeline of events when pod is deleted
 
",[],"[{'entity': 'Kubelet', 'description': 'A component that runs on each node in a Kubernetes cluster, responsible for managing pods and containers.', 'category': 'software'}, {'entity': 'SIGTERM', 'description': 'A signal sent to a process to terminate it gracefully.', 'category': 'process'}, {'entity': 'API server', 'description': 'The central component of the Kubernetes control plane that exposes the API for managing cluster resources.', 'category': 'software'}, {'entity': 'Endpoints controller', 'description': 'A component in the Kubernetes control plane that manages endpoint objects and updates iptables rules accordingly.', 'category': 'software'}, {'entity': 'Pod', 'description': 'The basic execution unit in a Kubernetes cluster, consisting of one or more containers.', 'category': 'container'}, {'entity': 'Container(s)', 'description': 'A lightweight and standalone executable package that contains an application and its dependencies.', 'category': 'container'}, {'entity': 'Kube-proxy', 'description': 'A component in the Kubernetes control plane that runs on each node and manages network traffic for pods.', 'category': 'software'}, {'entity': 'Iptables rules', 'description': 'Rules used to filter and manage incoming and outgoing network traffic in a Linux system.', 'category': 'network'}, {'entity': 'Connection Refused error', 'description': 'An error that occurs when a client tries to connect to a terminated pod.', 'category': 'error'}, {'entity': 'REST request', 'description': 'A type of HTTP request used for interacting with web services.', 'category': 'protocol'}, {'entity': 'API object', 'description': 'A Kubernetes resource that represents an API endpoint.', 'category': 'software'}, {'entity': 'Watcher(s)', 'description': 'Components in the Kubernetes control plane that monitor and respond to changes in cluster resources.', 'category': 'software'}]","[{'source_entity': '""Pod""', 'description': 'is created by', 'destination_entity': '""API server""'}, {'source_entity': '""Connection Refused error""', 'description': 'occurs when trying to connect to', 'destination_entity': '""API server""'}, {'source_entity': '""Watcher(s)""', 'description': 'monitors and updates', 'destination_entity': '""Iptables rules""'}, {'source_entity': '""Kubelet""', 'description': 'communicates with', 'destination_entity': '""API server""'}, {'source_entity': '""REST request""', 'description': 'is sent to', 'destination_entity': '""API server""'}, {'source_entity': '""Kube-proxy""', 'description': 'manages and updates', 'destination_entity': '""Iptables rules""'}, {'source_entity': '""SIGTERM""', 'description': 'signal is sent to', 'destination_entity': '""Container(s)""'}, {'source_entity': '""Endpoints controller""', 'description': 'manages and updates', 'destination_entity': '""API object""'}]","['[\n  {\n    ""source"": ""Pod"",\n    ""destination"": ""API Server"",\n    ""relation_description"": ""is created by"",\n    ""summary_er"": ""A Pod is created by the API server, which is a central component of Kubernetes that manages and orchestrates containerized applications.""\n  },\n  {\n    ""source"": ""API Server"",\n    ""destination"": ""Pod"",\n    ""relation_description"": ""manages"",\n    ""summary_er"": ""The API server manages Pods, which are the basic execution units in Kubernetes, ensuring they run efficiently and effectively.""\n  }\n]', '[\n  {\n    ""source"": ""Pod"",\n    ""destination"": ""API Server"",\n    ""relation_description"": ""Connection Refused error"",\n    ""summary_er"": ""When trying to connect to an API server, a Connection Refused error occurs due to a failed connection attempt between the client and the server.""\n  }\n]', '[\n  {\n    ""source"": ""Watcher(s)"",\n    ""destination"": ""pod"",\n    ""relation_description"": ""monitors and updates"",\n    ""summary_er"": ""The Watcher(s) monitors and updates the pod, ensuring its optimal performance.""\n  },\n  {\n    ""source"": ""Iptables rules"",\n    ""destination"": ""pod"",\n    ""relation_description"": """",\n    ""summary_er"": ""Iptables rules are applied to the pod for network security and access control.""\n  }\n]', '[\n  {\n    ""source"": ""Kubelet"",\n    ""destination"": ""pod"",\n    ""relation_description"": ""communicates with"",\n    ""summary_er"": ""The Kubelet communicates with pods to manage and monitor them.""\n  }\n]', '[\n  {\n    ""source"": ""REST request"",\n    ""destination"": ""API server"",\n    ""relation_description"": ""is sent to"",\n    ""summary_er"": ""A REST request is sent to the API server for processing and response.""\n  }\n]', '[\n  {\n    ""source"": ""Kube-proxy"",\n    ""destination"": ""pod"",\n    ""relation_description"": ""manages and updates"",\n    ""summary_er"": ""Kube-proxy manages and updates pod configurations, ensuring network connectivity and routing within a Kubernetes cluster.""\n  },\n  {\n    ""source"": ""Iptables rules"",\n    ""destination"": ""pod"",\n    ""relation_description"": """",\n    ""summary_er"": ""Iptables rules are used to configure network policies for pods in a Kubernetes cluster, controlling incoming and outgoing traffic.""\n  }\n]', '[\n  {\n    ""source"": ""SIGTERM"",\n    ""destination"": ""pod"",\n    ""relation_description"": ""signal is sent to"",\n    ""summary_er"": ""The SIGTERM signal is sent to a container or pod, typically indicating termination.""\n  },\n  {\n    ""source"": ""Container(s)"",\n    ""destination"": ""pod"",\n    ""relation_description"": ""container(s) are part of"",\n    ""summary_er"": ""A container or containers are part of a pod, which provides shared resources and networking.""\n  }\n]', '[\n  {\n    ""source"": ""Endpoints controller"",\n    ""destination"": ""pod"",\n    ""relation_description"": ""manages and updates"",\n    ""summary_er"": ""The Endpoints controller manages and updates information about pods in a Kubernetes cluster.""\n  },\n  {\n    ""source"": ""API object"",\n    ""destination"": ""pod"",\n    ""relation_description"": """",\n    ""summary_er"": ""An API object represents a pod in the Kubernetes system, providing access to its properties and behavior.""\n  }\n]']","When a pod is deleted in Kubernetes, two sequences of events occur in parallel: the Kubelet shuts down the app's process and removes it from iptables rules. The shutdown sequence is relatively short, while updating iptables rules involves a longer chain of events, including notification to the Endpoints controller, API server, and kube-proxy.","[{'highlight': ""When a pod is deleted, the Kubelet initiates a shutdown sequence that includes running the pre-stop hook, sending SIGTERM, waiting for a period of time, and then forcibly killing the container if it hasn't yet terminated on its own.""}, {'highlight': 'The Endpoints controller removes the pod as an endpoint in all services that the pod is a part of by modifying the Endpoints API object and notifying all clients watching the Endpoints object.'}, {'highlight': 'Removing iptables rules has no effect on existing connections, but prevents new connections from being forwarded to the terminating pod.'}, {'highlight': 'The time it takes for a pod to be shut down is relatively short compared to the time required for iptables rules to be updated, which involves multiple steps and notifications between components.'}, {'highlight': 'Existing clients connected to the pod will still send additional requests to the pod through existing connections even after the iptables rules have been updated.'}]"
438,527,0,[],"495
Ensuring all client requests are handled properly
then the API server must notify the kube-proxy before the proxy finally modifies the
iptables rules. A high probability exists that the SIGTERM signal will be sent well
before the iptables rules are updated on all nodes.
 The end result is that the pod may still receive client requests after it was sent the
termination signal. If the app closes the server socket and stops accepting connections
immediately, this will cause clients to receive “Connection Refused” types of errors
(similar to what happens at pod startup if your app isn’t capable of accepting connec-
tions immediately and you don’t define a readiness probe for it). 
SOLVING THE PROBLEM
Googling solutions to this problem makes it seem as though adding a readiness probe
to your pod will solve the problem. Supposedly, all you need to do is make the readi-
ness probe start failing as soon as the pod receives the SIGTERM. This is supposed to
cause the pod to be removed as the endpoint of the service. But the removal would
happen only after the readiness probe fails for a few consecutive times (this is configu-
rable in the readiness probe spec). And, obviously, the removal then still needs to
reach the kube-proxy before the pod is removed from iptables rules. 
 In reality, the readiness probe has absolutely no bearing on the whole process at
all. The Endpoints controller removes the pod from the service Endpoints as soon as
it receives notice of the pod being deleted (when the deletionTimestamp field in the
pod’s spec is no longer null). From that point on, the result of the readiness probe
is irrelevant.
 What’s the proper solution to the problem? How can you make sure all requests
are handled fully?
 It’s clear the pod needs to keep accepting connections even after it receives the ter-
mination signal up until all the kube-proxies have finished updating the iptables
rules. Well, it’s not only the kube-proxies. There may also be Ingress controllers or
load balancers forwarding connections to the pod directly, without going through the
Service (iptables). This also includes clients using client-side load-balancing. To
ensure none of the clients experience broken connections, you’d have to wait until all
of them somehow notify you they’ll no longer forward connections to the pod. 
 That’s impossible, because all those components are distributed across many dif-
ferent computers. Even if you knew the location of every one of them and could wait
until all of them say it’s okay to shut down the pod, what do you do if one of them
doesn’t respond? How long do you wait for the response? Remember, during that
time, you’re holding up the shut-down process. 
 The only reasonable thing you can do is wait for a long-enough time to ensure all
the proxies have done their job. But how long is long enough? A few seconds should
be enough in most situations, but there’s no guarantee it will suffice every time. When
the API server or the Endpoints controller is overloaded, it may take longer for the
notification to reach the kube-proxy. It’s important to understand that you can’t solve
the problem perfectly, but even adding a 5- or 10-second delay should improve the
user experience considerably. You can use a longer delay, but don’t go overboard,
 
",[],"[{'entity': 'SIGTERM signal', 'description': 'A signal sent to a process to terminate it', 'category': 'process'}, {'entity': 'kube-proxy', 'description': 'A component that modifies iptables rules', 'category': 'application'}, {'entity': 'iptables rules', 'description': 'Rules used by the kernel to filter network traffic', 'category': 'network'}, {'entity': 'readiness probe', 'description': 'A mechanism to determine if a pod is ready to receive traffic', 'category': 'process'}, {'entity': 'Endpoints controller', 'description': 'A component that removes pods from service Endpoints', 'category': 'application'}, {'entity': 'deletionTimestamp field', 'description': ""A field in the pod's spec that indicates when it will be deleted"", 'category': 'database'}, {'entity': 'kube-proxies', 'description': 'Components that modify iptables rules', 'category': 'application'}, {'entity': 'Ingress controllers', 'description': 'Components that forward connections to pods directly', 'category': 'application'}, {'entity': 'load balancers', 'description': 'Components that distribute traffic across multiple servers', 'category': 'network'}, {'entity': 'client-side load-balancing', 'description': 'A technique used by clients to distribute traffic across multiple servers', 'category': 'application'}, {'entity': 'API server', 'description': 'A component that manages the Kubernetes API', 'category': 'application'}, {'entity': 'Endpoints controller', 'description': 'A component that removes pods from service Endpoints', 'category': 'application'}, {'entity': 'pod', 'description': 'A unit of execution in Kubernetes', 'category': 'container'}, {'entity': 'service', 'description': 'An abstraction layer for accessing a group of pods', 'category': 'network'}, {'entity': 'termination signal', 'description': 'A signal sent to a pod to terminate it', 'category': 'process'}]","[{'source_entity': '""iptables rules""', 'description': 'enforce', 'destination_entity': '""Ingress controllers""'}, {'source_entity': '""Ingress controllers""', 'description': 'handle', 'destination_entity': '""load balancers""'}, {'source_entity': '""API server""', 'description': 'communicate with', 'destination_entity': '""kube-proxies""'}, {'source_entity': '""kube-proxies""', 'description': 'forward requests to', 'destination_entity': '""service""'}, {'source_entity': '""client-side load-balancing""', 'description': 'distribute traffic across', 'destination_entity': '""pod""'}, {'source_entity': '""SIGTERM signal""', 'description': 'terminate', 'destination_entity': '""API server""'}, {'source_entity': '""termination signal""', 'description': 'kill', 'destination_entity': '""kube-proxies""'}, {'source_entity': '""readiness probe""', 'description': 'check the health of', 'destination_entity': '""pod""'}, {'source_entity': '""Endpoints controller""', 'description': 'manage', 'destination_entity': '""service""'}, {'source_entity': '""deletionTimestamp field""', 'description': 'indicate when to delete', 'destination_entity': '""pod""'}]","['[\n  {\n    ""source"": ""iptables rules"",\n    ""destination"": ""pod"",\n    ""relation_description"": ""enforce"",\n    ""summary_er"": ""Iptables rules are enforced on a pod to control incoming and outgoing network traffic, ensuring security and access control.""\n  },\n  {\n    ""source"": ""Ingress controllers"",\n    ""destination"": ""pod"",\n    ""relation_description"": ""control"",\n    ""summary_er"": ""Ingress controllers manage incoming HTTP requests for multiple services running in a pod, routing traffic to the correct service.""\n  }\n]', '[\n  {\n    ""source"": ""Ingress controllers"",\n    ""destination"": ""pod"",\n    ""relation_description"": ""handle"",\n    ""summary_er"": ""Ingress controllers handle incoming traffic by routing it to a pod, which can be a containerized application or service.""\n  },\n  {\n    ""source"": ""load balancers"",\n    ""destination"": ""pod"",\n    ""relation_description"": ""route traffic"",\n    ""summary_er"": ""Load balancers distribute incoming traffic across multiple pods, ensuring efficient resource utilization and high availability.""\n  }\n]', '[\n  {\n    ""source"": ""API server"",\n    ""destination"": ""kube-proxies"",\n    ""relation_description"": ""communicate with"",\n    ""summary_er"": ""The API server communicates with kube-proxy to manage network policies and routing.""\n  }\n]', '[\n  {\n    ""source"": ""kube-proxies"",\n    ""destination"": ""pod"",\n    ""relation_description"": ""forward requests to"",\n    ""summary_er"": ""Kube proxies forward incoming requests from services to their corresponding pods, enabling communication between services and pods within a Kubernetes cluster.""\n  }\n]', '[\n  {\n    ""source"": ""client-side load-balancing"",\n    ""destination"": ""pod"",\n    ""relation_description"": ""distribute traffic across"",\n    ""summary_er"": ""Client-side load balancing distributes incoming traffic across multiple pods for efficient resource utilization and high availability.""\n  }\n]', '[\n  {\n    ""source"": ""SIGTERM signal"",\n    ""destination"": ""pod"",\n    ""relation_description"": ""terminate"",\n    ""summary_er"": ""The SIGTERM signal is sent to a pod to initiate its termination process, allowing for graceful shutdown and cleanup of resources.""\n  }\n]', '[\n  {\n    ""source"": ""termination signal"",\n    ""destination"": ""pod kube-proxies"",\n    ""relation_description"": ""kill"",\n    ""summary_er"": ""A termination signal sent to a pod named \'kube-proxies\' results in its immediate termination.""\n  }\n]', '[\n  {\n    ""source"": ""readiness probe"",\n    ""destination"": ""pod"",\n    ""relation_description"": ""check the health of"",\n    ""summary_er"": ""A readiness probe in Kubernetes checks the health of a pod by executing a command or making an HTTP request to determine if it\'s ready to serve traffic.""\n  }\n]', '[\n  {\n    ""source"": ""Endpoints controller"",\n    ""destination"": ""pod"",\n    ""relation_description"": ""manage"",\n    ""summary_er"": ""The Endpoints controller manages a collection of endpoint objects, which represent network services offered by pods.""\n  }\n]', '[\n  {\n    ""source"": ""deletionTimestamp field"",\n    ""destination"": ""pod"",\n    ""relation_description"": ""indicate when to delete"",\n    ""summary_er"": ""The deletionTimestamp field in a Kubernetes object indicates when it should be deleted, typically used for pod management.""\n  }\n]']","The pod needs to keep accepting connections after receiving the termination signal until all kube-proxies and other components have finished updating their rules. A long-enough delay, such as 5-10 seconds, should be added before shutting down the pod to ensure a smooth user experience.","[{'highlight': ""The readiness probe has no bearing on the process of removing a pod from a service's Endpoints after receiving notice of deletion.""}, {'highlight': 'To ensure all requests are handled fully, the pod needs to keep accepting connections until all kube-proxies have finished updating iptables rules.'}, {'highlight': ""Waiting for all clients to notify that they'll no longer forward connections is impossible due to distributed components across many computers.""}, {'highlight': ""Adding a delay of 5-10 seconds before shutting down the pod can improve user experience, but there's no guarantee it will suffice every time.""}, {'highlight': 'The Endpoints controller removes the pod from the service Endpoints as soon as it receives notice of deletion, regardless of readiness probe results.'}]"
