,page,img_cnt,img_npy_lst,text,tables,entities,relationships,summary_rel,summary,highlights
432,521,0,[],"489
Understanding the pod’s lifecycle
 A container using the first form runs the mybinary executable as its main process,
whereas the second form runs a shell as the main process with the mybinary process
executed as a child of the shell process.
UNDERSTANDING THAT LIFECYCLE HOOKS TARGET CONTAINERS, NOT PODS
As a final thought on post-start and pre-stop hooks, let me emphasize that these lifecy-
cle hooks relate to containers, not pods. You shouldn’t use a pre-stop hook for run-
ning actions that need to be performed when the pod is terminating. The reason is
that the pre-stop hook gets called when the container is being terminated (most likely
because of a failed liveness probe). This may happen multiple times in the pod’s life-
time, not only when the pod is in the process of being shut down. 
17.2.5 Understanding pod shutdown
We’ve touched on the subject of pod termination, so let’s explore this subject in more
detail and go over exactly what happens during pod shutdown. This is important for
understanding how to cleanly shut down an application running in a pod.
 Let’s start at the beginning. A pod’s shut-down is triggered by the deletion of the
Pod object through the API server. Upon receiving an HTTP DELETE request, the
API server doesn’t delete the object yet, but only sets a deletionTimestamp field in it.
Pods that have the deletionTimestamp field set are terminating. 
 Once the Kubelet notices the pod needs to be terminated, it starts terminating
each of the pod’s containers. It gives each container time to shut down gracefully, but
the time is limited. That time is called the termination grace period and is configu-
rable per pod. The timer starts as soon as the termination process starts. Then the fol-
lowing sequence of events is performed:
1
Run the pre-stop hook, if one is configured, and wait for it to finish.
2
Send the SIGTERM signal to the main process of the container.
3
Wait until the container shuts down cleanly or until the termination grace
period runs out.
4
Forcibly kill the process with SIGKILL, if it hasn’t terminated gracefully yet.
The sequence of events is illustrated in figure 17.5.
Pre-stop hook process
Termination grace period
Main container process
Container shutdown
initiated
Container killed
if still running
Time
SIGTERM
SIGKILL
Figure 17.5
The container termination sequence
 
","[  Main container process Col1 Col2
0                                 ]","[{'entity': 'container', 'description': 'A process that runs within a pod, with its own lifecycle and hooks.', 'category': 'software'}, {'entity': 'pod', 'description': 'The basic execution unit in Kubernetes, consisting of one or more containers.', 'category': 'application'}, {'entity': 'Kubelet', 'description': 'A component of the Kubernetes control plane that runs on each node and is responsible for managing pods and containers.', 'category': 'software'}, {'entity': 'API server', 'description': ""The central component of the Kubernetes control plane, responsible for storing and retrieving data about the cluster's resources."", 'category': 'software'}, {'entity': 'deletionTimestamp', 'description': 'A field in a Pod object that indicates when the pod is scheduled to be deleted.', 'category': 'database'}, {'entity': 'pre-stop hook', 'description': 'A lifecycle hook that runs before a container is terminated, allowing it to perform any necessary cleanup or shutdown actions.', 'category': 'software'}, {'entity': 'SIGTERM', 'description': 'A signal sent to a process to request its termination, but allowing it to clean up and shut down cleanly.', 'category': 'hardware'}, {'entity': 'SIGKILL', 'description': 'A signal sent to a process to forcibly terminate it, without allowing it to clean up or shut down cleanly.', 'category': 'hardware'}, {'entity': 'termination grace period', 'description': 'The time allowed for a container to shut down cleanly before being forcibly terminated.', 'category': 'process'}]","[{'source_entity': '""container""', 'description': 'is terminated', 'destination_entity': '""pod""'}, {'source_entity': '""pod""', 'description': 'sets', 'destination_entity': '""termination grace period""'}, {'source_entity': '""API server""', 'description': 'receives', 'destination_entity': '""deletionTimestamp""'}, {'source_entity': '""pre-stop hook""', 'description': 'executes', 'destination_entity': '""container""'}, {'source_entity': '""SIGKILL""', 'description': 'kills', 'destination_entity': '""container""'}, {'source_entity': '""Kubelet""', 'description': 'sends', 'destination_entity': '""SIGTERM""'}, {'source_entity': '""deletionTimestamp""', 'description': 'is checked by', 'destination_entity': '""API server""'}]","['[\n  {\n    ""source"": ""container"",\n    ""destination"": ""pod"",\n    ""relation_description"": ""is terminated"",\n    ""summary_er"": ""A container is terminated when its execution is completed or it encounters an error, resulting in the pod\'s lifecycle being affected.""\n  }\n]', '[\n  {\n    ""source"": ""pod"",\n    ""destination"": ""pod"",\n    ""relation_description"": ""sets"",\n    ""summary_er"": ""A Kubernetes pod is set to a specific configuration, defining its lifecycle and behavior.""\n  },\n  {\n    ""source"": ""termination grace period"",\n    ""destination"": ""pod"",\n    ""relation_description"": """",\n    ""summary_er"": ""The termination grace period is the time allowed for a pod to terminate before it is forcefully killed by Kubernetes.""\n  }\n]', '[\n  {\n    ""source"": ""API server"",\n    ""destination"": ""pod"",\n    ""relation_description"": ""receives"",\n    ""summary_er"": ""The API server receives deletion requests for a pod, initiating its removal from the system.""\n  }\n]', '[\n  {\n    ""source"": ""pre-stop hook"",\n    ""destination"": ""pod"",\n    ""relation_description"": ""executes"",\n    ""summary_er"": ""A pre-stop hook in Kubernetes executes a command on a pod before it is terminated.""\n  }\n]', '[\n  {\n    ""source"": ""SIGKILL"",\n    ""destination"": ""pod"",\n    ""relation_description"": ""kills"",\n    ""summary_er"": ""SIGKILL signal terminates a running container within a pod, effectively killing it.""\n  }\n]', '[\n  {\n    ""source"": ""Kubelet"",\n    ""destination"": ""pod"",\n    ""relation_description"": ""sends"",\n    ""summary_er"": ""The Kubelet sends a SIGTERM signal to a pod, initiating its termination process.""\n  }\n]', '[\n  {\n    ""source"": ""API server"",\n    ""destination"": ""pod"",\n    ""relation_description"": ""is checked by"",\n    ""summary_er"": ""The API server checks the existence of a pod before performing deletion operations.""\n  }\n]']","A pod's lifecycle involves container termination, triggered by the deletion of the Pod object through the API server. The Kubelet terminates each container, running pre-stop hooks and sending SIGTERM signals to main processes. If containers don't shut down cleanly within the configured termination grace period, they are forcibly killed with a SIGKILL signal.","[{'highlight': ""A pod's shut-down is triggered by the deletion of the Pod object through the API server.""}, {'highlight': ""The Kubelet notices the pod needs to be terminated, it starts terminating each of the pod's containers with a configurable termination grace period.""}, {'highlight': ""The sequence of events during pod shutdown is: run the pre-stop hook, send SIGTERM signal to the main process, wait for container shutdown or until the termination grace period runs out, and forcibly kill the process if it hasn't terminated gracefully yet.""}, {'highlight': ""Pre-stop hooks target containers, not pods, and shouldn't be used for running actions that need to be performed when the pod is terminating.""}, {'highlight': ""A pod's termination involves setting a deletionTimestamp field in the Pod object, which triggers the Kubelet to terminate each container with a configurable termination grace period.""}]"
433,522,0,[],"490
CHAPTER 17
Best practices for developing apps
SPECIFYING THE TERMINATION GRACE PERIOD
The termination grace period can be configured in the pod spec by setting the spec.
terminationGracePeriodSeconds field. It defaults to 30, which means the pod’s con-
tainers will be given 30 seconds to terminate gracefully before they’re killed forcibly. 
TIP
You should set the grace period to long enough so your process can fin-
ish cleaning up in that time. 
The grace period specified in the pod spec can also be overridden when deleting the
pod like this:
$ kubectl delete po mypod --grace-period=5
This will make the Kubelet wait five seconds for the pod to shut down cleanly. When
all the pod’s containers stop, the Kubelet notifies the API server and the Pod resource
is finally deleted. You can force the API server to delete the resource immediately,
without waiting for confirmation, by setting the grace period to zero and adding the
--force option like this:
$ kubectl delete po mypod --grace-period=0 --force
Be careful when using this option, especially with pods of a StatefulSet. The Stateful-
Set controller takes great care to never run two instances of the same pod at the same
time (two pods with the same ordinal index and name and attached to the same
PersistentVolume). By force-deleting a pod, you’ll cause the controller to create a
replacement pod without waiting for the containers of the deleted pod to shut
down. In other words, two instances of the same pod might be running at the same
time, which may cause your stateful cluster to malfunction. Only delete stateful pods
forcibly when you’re absolutely sure the pod isn’t running anymore or can’t talk to
the other members of the cluster (you can be sure of this when you confirm that the
node that hosted the pod has failed or has been disconnected from the network and
can’t reconnect). 
 Now that you understand how containers are shut down, let’s look at it from the
application’s perspective and go over how applications should handle the shutdown
procedure.
IMPLEMENTING THE PROPER SHUTDOWN HANDLER IN YOUR APPLICATION
Applications should react to a SIGTERM signal by starting their shut-down procedure
and terminating when it finishes. Instead of handling the SIGTERM signal, the applica-
tion can be notified to shut down through a pre-stop hook. In both cases, the app
then only has a fixed amount of time to terminate cleanly. 
 But what if you can’t predict how long the app will take to shut down cleanly? For
example, imagine your app is a distributed data store. On scale-down, one of the pod
instances will be deleted and therefore shut down. In the shut-down procedure, the
 
",[],"[{'entity': 'termination grace period', 'description': ""The time given to a pod's containers to terminate gracefully before being killed forcibly."", 'category': 'process'}, {'entity': 'spec.terminationGracePeriodSeconds', 'description': 'A field in the pod spec that configures the termination grace period.', 'category': 'command'}, {'entity': 'Kubelet', 'description': 'The agent that runs on each node and is responsible for running containers and notifying the API server when a pod has shut down.', 'category': 'process'}, {'entity': 'API server', 'description': 'The central component of Kubernetes that manages all cluster resources.', 'category': 'application'}, {'entity': 'kubectl delete', 'description': 'A command used to delete a pod, with options for specifying the termination grace period and forcing deletion.', 'category': 'command'}, {'entity': 'StatefulSet controller', 'description': 'A component that manages stateful sets by ensuring that only one instance of each pod is running at any given time.', 'category': 'application'}, {'entity': 'SIGTERM signal', 'description': 'A signal sent to a process to indicate that it should terminate cleanly.', 'category': 'signal'}, {'entity': 'pre-stop hook', 'description': 'A mechanism for notifying an application to shut down before terminating the pod.', 'category': 'process'}, {'entity': 'pod instances', 'description': 'The individual containers that make up a pod.', 'category': 'container'}, {'entity': 'scale-down', 'description': 'A process by which the number of replicas in a deployment is reduced.', 'category': 'process'}]","[{'source_entity': '""kubectl delete""', 'description': 'deletes', 'destination_entity': '""pod instances""'}, {'source_entity': '""termination grace period""', 'description': 'specifies', 'destination_entity': '""API server""'}, {'source_entity': '""pre-stop hook""', 'description': 'executes before', 'destination_entity': '""SIGTERM signal""'}, {'source_entity': '""StatefulSet controller""', 'description': 'manages', 'destination_entity': '""pod instances""'}, {'source_entity': '""Kubelet""', 'description': 'communicates with', 'destination_entity': '""API server""'}, {'source_entity': '""spec.terminationGracePeriodSeconds""', 'description': 'configures', 'destination_entity': '""pod instances""'}, {'source_entity': '""scale-down""', 'description': 'reduces the number of', 'destination_entity': '""pod instances""'}]","['[\n  {\n    ""source"": ""kubectl"",\n    ""destination"": ""pod"",\n    ""relation_description"": ""deletes"",\n    ""summary_er"": ""Kubernetes command \'kubectl delete\' removes a pod instance from the cluster.""\n  }\n]', '[\n  {\n    ""source"": ""termination grace period"",\n    ""destination"": ""pod"",\n    ""relation_description"": ""specifies"",\n    ""summary_er"": ""The termination grace period is a setting that specifies how long a pod can run after being deleted, allowing for cleanup and resource release.""\n  }\n]', '[\n  {\n    ""source"": ""pre-stop hook"",\n    ""destination"": ""pod"",\n    ""relation_description"": ""executes before"",\n    ""summary_er"": ""The pre-stop hook executes a command before terminating a pod, allowing for cleanup or other necessary actions.""\n  },\n  {\n    ""source"": ""SIGTERM signal"",\n    ""destination"": ""pre-stop hook"",\n    ""relation_description"": ""triggers"",\n    ""summary_er"": ""The SIGTERM signal triggers the execution of the pre-stop hook, which prepares the pod for termination.""\n  }\n]', '[\n  {\n    ""source"": ""StatefulSet controller"",\n    ""destination"": ""pod instances"",\n    ""relation_description"": ""manages"",\n    ""summary_er"": ""The StatefulSet controller manages a set of identical pod instances, ensuring consistent state across multiple replicas.""\n  }\n]', '[\n  {\n    ""source"": ""Kubelet"",\n    ""destination"": ""pod"",\n    ""relation_description"": ""communicates with"",\n    ""summary_er"": ""The Kubelet communicates with a pod to manage and monitor its lifecycle.""\n  }\n]', '[\n  {\n    ""source"": ""spec"",\n    ""destination"": ""pod instances"",\n    ""relation_description"": ""configures"",\n    ""summary_er"": ""The spec entity configures the pod instances by setting termination grace period seconds.""\n  }\n]', '[\n  {\n    ""source"": ""scale-down"",\n    ""destination"": ""pod instances"",\n    ""relation_description"": ""reduces the number of"",\n    ""summary_er"": ""The scale-down operation reduces the number of pod instances, potentially saving resources.""\n  }\n]']","The termination grace period for Kubernetes pods can be configured in the pod spec or overridden when deleting the pod. It's essential to set a sufficient time for processes to finish cleaning up before being killed. Applications should react to SIGTERM signals by starting their shut-down procedure and terminating within a fixed amount of time, using pre-stop hooks if necessary.","[{'highlight': 'The termination grace period can be configured in the pod spec by setting the spec.terminationGracePeriodSeconds field.'}, {'highlight': 'You should set the grace period to long enough so your process can finish cleaning up in that time.'}, {'highlight': 'When deleting a pod, you can override the specified grace period using the --grace-period option with kubectl delete command.'}, {'highlight': 'Applications should react to a SIGTERM signal by starting their shut-down procedure and terminating when it finishes.'}, {'highlight': 'Be careful when force-deleting a pod, especially with pods of a StatefulSet, as it may cause the controller to create a replacement pod without waiting for the containers of the deleted pod to shut down.'}]"
434,523,0,[],"491
Understanding the pod’s lifecycle
pod needs to migrate all its data to the remaining pods to make sure it’s not lost.
Should the pod start migrating the data upon receiving a termination signal (through
either the SIGTERM signal or through a pre-stop hook)? 
 Absolutely not! This is not recommended for at least the following two reasons:
A container terminating doesn’t necessarily mean the whole pod is being
terminated.
You have no guarantee the shut-down procedure will finish before the process
is killed.
This second scenario doesn’t happen only when the grace period runs out before the
application has finished shutting down gracefully, but also when the node running
the pod fails in the middle of the container shut-down sequence. Even if the node
then starts up again, the Kubelet will not restart the shut-down procedure (it won’t
even start up the container again). There are absolutely no guarantees that the pod
will be allowed to complete its whole shut-down procedure.
REPLACING CRITICAL SHUT-DOWN PROCEDURES WITH DEDICATED SHUT-DOWN PROCEDURE PODS
How do you ensure that a critical shut-down procedure that absolutely must run to
completion does run to completion (for example, to ensure that a pod’s data is
migrated to other pods)?
 One solution is for the app (upon receipt of a termination signal) to create a new
Job resource that would run a new pod, whose sole job is to migrate the deleted pod’s
data to the remaining pods. But if you’ve been paying attention, you’ll know that you
have no guarantee the app will indeed manage to create the Job object every single
time. What if the node fails exactly when the app tries to do that? 
 The proper way to handle this problem is by having a dedicated, constantly run-
ning pod that keeps checking for the existence of orphaned data. When this pod finds
the orphaned data, it can migrate it to the remaining pods. Rather than a constantly
running pod, you can also use a CronJob resource and run the pod periodically. 
 You may think StatefulSets could help here, but they don’t. As you’ll remember,
scaling down a StatefulSet leaves PersistentVolumeClaims orphaned, leaving the data
stored on the PersistentVolume stranded. Yes, upon a subsequent scale-up, the Persistent-
Volume will be reattached to the new pod instance, but what if that scale-up never
happens (or happens after a long time)? For this reason, you may want to run a
data-migrating pod also when using StatefulSets (this scenario is shown in figure 17.6).
To prevent the migration from occurring during an application upgrade, the data-
migrating pod could be configured to wait a while to give the stateful pod time to
come up again before performing the migration.
 
 
 
",[],"[{'entity': 'pod', 'description': 'A container that runs as one or more processes within a cluster.', 'category': 'container'}, {'entity': 'SIGTERM signal', 'description': 'A signal sent to a process to terminate it.', 'category': 'signal'}, {'entity': 'pre-stop hook', 'description': 'A script executed before a pod is terminated.', 'category': 'hook'}, {'entity': 'Kubelet', 'description': 'The agent that runs on each node in a cluster and manages the running of pods.', 'category': 'agent'}, {'entity': 'Job resource', 'description': 'A resource used to run a batch job, such as migrating data from one pod to another.', 'category': 'resource'}, {'entity': 'CronJob resource', 'description': 'A resource used to schedule the running of a job at specific times or intervals.', 'category': 'resource'}, {'entity': 'StatefulSet', 'description': 'A resource used to manage stateful applications, such as databases or file systems.', 'category': 'resource'}, {'entity': 'PersistentVolumeClaim', 'description': 'A request for storage resources, such as a disk or volume.', 'category': 'resource'}, {'entity': 'data-migrating pod', 'description': 'A pod that runs a script to migrate data from one location to another.', 'category': 'pod'}]","[{'source_entity': '""CronJob resource""', 'description': 'schedules', 'destination_entity': '""pod""'}, {'source_entity': '""CronJob resource""', 'description': 'manages', 'destination_entity': '""data-migrating pod""'}, {'source_entity': '""Job resource""', 'description': 'executes', 'destination_entity': '""pod""'}, {'source_entity': '""PersistentVolumeClaim""', 'description': 'requests', 'destination_entity': '""Persistent Volume""'}, {'source_entity': '""pre-stop hook""', 'description': 'triggers', 'destination_entity': '""Kubelet""'}, {'source_entity': '""SIGTERM signal""', 'description': 'terminates', 'destination_entity': '""pod""'}, {'source_entity': '""StatefulSet""', 'description': 'manages', 'destination_entity': '""pod""'}]","['[\n  {\n    ""source"": ""CronJob resource"",\n    ""destination"": ""Pod"",\n    ""relation_description"": ""schedules"",\n    ""summary_er"": ""A CronJob resource schedules a Pod to run periodically, ensuring timely execution of tasks.""\n  }\n]', '[\n  {\n    ""source"": ""CronJob resource"",\n    ""destination"": ""pod"",\n    ""relation_description"": ""manages"",\n    ""summary_er"": ""The CronJob resource manages a pod, which is a containerized application that can run in a Kubernetes cluster.""\n  }\n]', '[\n  {\n    ""source"": ""Job resource"",\n    ""destination"": ""Pod"",\n    ""relation_description"": ""executes"",\n    ""summary_er"": ""A Job resource executes a Pod, which is a containerized application.""\n  }\n]', '[\n  {\n    ""source"": ""PersistentVolumeClaim"",\n    ""destination"": ""pod"",\n    ""relation_description"": ""requests"",\n    ""summary_er"": ""A PersistentVolumeClaim requests resources from a pod, ensuring sufficient storage for the application.""\n  }\n]', '[\n  {\n    ""source"": ""pre-stop hook"",\n    ""destination"": ""pod"",\n    ""relation_description"": ""triggers"",\n    ""summary_er"": ""A pre-stop hook in Kubernetes triggers a specific action on a pod, typically before it is terminated.""\n  }\n]', '[\n  {\n    ""source"": ""SIGTERM signal"",\n    ""destination"": ""pod"",\n    ""relation_description"": ""terminates"",\n    ""summary_er"": ""The SIGTERM signal causes a running container to terminate, effectively shutting down the pod.""\n  }\n]', '[\n  {\n    ""source"": ""StatefulSet"",\n    ""destination"": ""pod"",\n    ""relation_description"": ""manages"",\n    ""summary_er"": ""A StatefulSet manages a set of identical pods, ensuring that a specified number of replicas are running at any given time.""\n  }\n]']","When a Kubernetes pod receives a termination signal, it should not start migrating its data immediately. Instead, a dedicated pod or CronJob resource can be used to periodically check for orphaned data and migrate it to remaining pods, ensuring data is not lost in case of node failure or application upgrade.",[{'highlight': 'A container terminating doesn’t necessarily mean the whole pod is being terminated.'}]
